"","","それから数日が過ぎたある日の夜。","","",""
"","","寮の部屋でくつろいでいると、誰かが訪ねてきた。","","",""
"ツカサ","","こんな時間に誰だろう？","","",""
"アイラ","","ミチルか、エルじゃない？","","",""
"","","特に疑問を持たず、俺は玄関へ向かった。","","",""
"","","でも、ドアを開けたら、そこにいたのは意外な人物だった。","","",""
"シェリー","","こんばんは","","",""
"ツカサ","","シェリー……？　どうしたの？","","",""
"シェリー","","アイラとツカサに、お話があってうかがいました","","",""
"ツカサ","","話……？","","",""
"ツカサ","","えっと、とにかく中へどうぞ","","",""
"アイラ","","シェリー。いらっしゃい","","",""
"シェリー","","こんな時間にすみません","","",""
"アイラ","","ううん。お茶、淹れるね","","",""
"","","アイラはキッチンへ入り、ハーブティーを淹れ始める。","","",""
"ツカサ","","シェリーがここに来るなんて、珍しいね","","",""
"","","シェリーはこの寮で暮らしているわけじゃない。\nヤスタカさんと一緒に、どこかのマンションで暮らしているって聞いた。","","",""
"","","だから、普通ならシェリーがここを訪ねることはないんだ。","","",""
"シェリー","","この寮を訪ねるのははじめてです","","",""
"ツカサ","","へえ、そう？","","",""
"シェリー","","ヤスタカは、私がターミナルサービスに入ったときには、すでに今のマンションで暮らしていましたから","","",""
"ツカサ","","そこって、ヤスタカさんの持ち家なの？","","",""
"シェリー","","いえ。賃貸です","","",""
"","","寮はＳＡＩ社の社員なら格安で借りられるけど、入るか入らないかは自由だ。","","",""
"","","そうでない社員の人は、自分で住まいを確保してそこで暮らすんだ。","","",""
"シェリー","","ヤスタカは滅多に帰ってきませんが。それでも家賃は折半しています","","",""
"","","ヤスタカさんって、意外とその辺ちゃんとしてるんだ……。","","",""
"アイラ","","お待たせ","","",""
"","","アイラが、３人分のハーブティーを用意してくれた。","","",""
"","","お茶を飲んで一息ついたところで、シェリーが本題を切り出した。","","",""
"シェリー","","今日うかがったのは、他でもありません","","",""
"シェリー","","アイラの回収を、私に担当させてもらいたいのです","","",""
"","","アイラの回収を……。","","",""
"アイラ","","…………","","",""
"","","アイラは困ったような顔で俺を見た。","","",""
"ツカサ","","それって、カヅキさんから言われて？","","",""
"シェリー","","いいえ。独断でお願いに来ました。カヅキにもヤスタカにもまだ話してはいません","","",""
"ツカサ","","そうなんだ……","","",""
"","","シェリーがこんな行動に出てくるなんて、ちょっとビックリした。","","",""
"ツカサ","","なにか、理由があるの？","","",""
"シェリー","","理由、ですか……","","",""
"シェリー","","今、第１ターミナルサービス所属のギフティアのうち、私より長く勤続しているのは、アイラだけです","","",""
"","","あ、そっか。確かにその通りだ。","","",""
"","","ギフティアって見た目と年齢――生まれてから過ごしてきた時間――が一致してないから、いまいちピンと来ないんだけど。","","",""
"アイラ","","シェリーは、もう７年目ぐらい","","",""
"シェリー","","６４３０５時間になります","","",""
"アイラ","","ヤスタカの前のパートナー……エンビィが異動になって、その補充でシェリーが入ったの","","",""
"シェリー","","エンビィは、ヤスタカに愛想を尽かして異動願いを出したと聞いています","","",""
"ツカサ","","そ、そうなんだ……","","",""
"","","あの人、昔からちゃらんぽらんだったのか……。","","",""
"シェリー","","ああ、いえ、ヤスタカの話は今はどうでもよくてですね……","","",""
"シェリー","","私が第１ターミナルサービスに来た当初、アイラに、とてもお世話になったのです","","",""
"アイラ","","お世話……。した、かな？","","",""
"シェリー","","ええ。右も左も分からない新人の私に、丁寧に指導をしてくれました","","",""
"アイラ","","基本的なことを、教えてあげただけだよ","","",""
"シェリー","","かもしれませんが。アイラがいなければ、私はこの仕事に慣れるのに、もっと時間を必要としたかもしれません","","",""
"シェリー","","なにしろ、ヤスタカがなにも教えてくれませんでしたから","","",""
"","","放任主義……っていうことなんだろうか。違うだろうなあ……。","","",""
"シェリー","","あのままでは、ヤスタカに振り回されるだけ振り回されて、前任者と同じく異動を願い出ていたかも","","",""
"シェリー","","そうなっては、今の私はなかったでしょう","","",""
"シェリー","","そういう理由で私は、アイラのことを、姉のような存在だと思っているのです","","",""
"アイラ","","え？　そうだったの！？","","",""
"アイラ","","全然、知らなかった……","","",""
"","","アイラの方がビックリしている。","","",""
"シェリー","","すみません。口に出して言うことでもないかと思いまして。これまで、伝える機会はありませんでした","","",""
"","","シェリーらしいな……。","","",""
"シェリー","","恩を返したいという意味でも、アイラの回収は、私が担当したいのです","","",""
"シェリー","","どうか、お願いできませんか？","","",""
"","","シェリーはピンと背筋を伸ばして、しっかりと俺とアイラを見て、そう頼んできた。","","",""
"ツカサ","","ええと、とりあえずカヅキさんに聞いてみないと――","","",""
"アイラ","","いいよ","","",""
"ツカサ","","え？","","",""
"シェリー","","本当ですか？","","",""
"アイラ","","うん","","",""
"アイラ","","シェリーなら、安心して任せられるので","","",""
"アイラ","","こちらこそ、お願いします","","",""
"シェリー","","……っ","","",""
"シェリー","","精一杯、頑張ります","","",""
"","","アイラが差し出した手を、シェリーはそっと握りしめた。","","",""
"","","カヅキさんたちになにも話をしないまま決めちゃって、大丈夫だったのかな。","","",""
"","","俺としても、別にシェリーが担当になってくれることは、全然問題ないんだけど。","","",""
"シェリー","","では、失礼します。お休みなさい、アイラ、ツカサ","","",""
"アイラ","","うん。おやすみ","","",""
"ツカサ","","おやすみ。気を付けて帰ってね","","",""
"","","シェリーは、スポーツカー――ヤスタカさんの自家用車らしい――に乗り込むと、颯爽と走り去っていった。","","",""
"","","それを見送ってから、課長とカヅキさん、それとヤスタカさんに、さっきの件についての報告メールを送信した。","","",""
"ツカサ","","ねえアイラ。シェリーって、どんなギフティアなの？","","",""
"","","実はシェリーとは、そこまで交流がないんだよね。\nだから、どんな人となりなのか、いちまち分からないんだ。","","",""
"","","シェリーは、いつも仕事をしているイメージ、かな。\n夜、飲みに行くっていうタイプでもなさそうだし。","","",""
"","","後は、ヤスタカさん相手にいつも怒っている。\nたまに、エルさん相手にも怒っている。","","",""
"アイラ","","シェリーは、怒ると、カヅキよりも怖い","","",""
"ツカサ","","あはは、だよね……","","",""
"","","そこは俺の感じた通りだったみたいだ。","","",""
"アイラ","","でも、ああ見えて、すごく優しいよ","","",""
"ツカサ","","え？","","",""
"","","優しい……んだ。","","",""
"","","シェリーには悪いけど、そういうイメージはあんまりなかったなあ。","","",""
"アイラ","","あ、ツカサ、今、意外っていう顔した","","",""
"ツカサ","","う……","","",""
"","","見抜かれちゃった……。","","",""
"ツカサ","","シェリーには、内緒にしてね","","",""
"アイラ","","ふふっ、分かった","","",""
"ツカサ","","ただ……えっと、どの辺が、優しいの？","","",""
"アイラ","","シェリーのことを知っていけば、そのうち分かるよ","","",""
"ツカサ","","ええ～、教えてよ、アイラ～","","",""
"アイラ","","ダメ。シェリーに悪いので","","",""
"","","アイラは笑いながらそう言うと、寮の中へと戻っていった。","","",""
"ツカサ","","うーん、女の子ってやっぱり分からない……","","",""
"","","シェリーには、俺の知らない別の顔があるんだろうなあ。","","",""
"","","ちょっと想像してみたけど、シェリーが笑っているところをまったく想像できなかった。","","",""
"","","翌日。カヅキさんはシェリーの直談判を受け入れ、正式にアイラの回収担当がシェリーとヤスタカさんに決まった。","","",""
