"0","","","今日の俺とアイラの予定は、いつも通りオフィスに出勤。","","",""
"1","","","仕事らしい仕事はないんだけど、こうして会社に出て来るのはアイラの望みでもあった。","","",""
"2","コンスタンス","","でも、本当によかったです。ツカサとアイラがうまくいっているようで","","",""
"3","","","昼休みには、みんなで雑談をする。これも、いつもと同じ光景だ。","","",""
"4","","","ヤスタカさんが出勤してきていないのも、いつも通りだしね。","","",""
"5","ザック","","見せつけられちゃって困るよね～。隣に住んでるとさ","","",""
"6","ミチル","","なにを今さら。ツカサなんて、付き合う前からアイラに“好き好きオーラ”を出しまくってたじゃない","","",""
"7","ツカサ","","え！？　出してた！？","","",""
"8","","","もしかして、周囲にはバレバレだったのかな。いつから……？","","",""
"9","ミチル","","っていうか、やっぱりふたりが付き合うことになったきっかけって、同じ部屋で暮らしてたからなのかしら","","",""
"10","ミチル","","ねえ、カヅキさん。パートナー同士で一緒に暮らすっていう規則があるくらいだし、ターミナルサービスって社内恋愛推奨なんですか？","","",""
"11","カヅキ","","はあ？","","",""
"12","","","いきなり質問されて、カヅキさんは困惑顔だ。","","",""
"13","ザック","","へぇ。じゃあ、ミチルは僕との恋愛を推奨されたいんだ～？","","",""
"14","ミチル","","そんなわけないでしょ。私の話は今はどうでもいいの！","","",""
"15","ミチル","","考えてみたら、うちって４組とも男女のペアじゃないですか。にもかかわらず同居させるのって、他の部署じゃなさそうな状況だと思います","","",""
"16","タカオ","","たまたまだよ。同性のペアだっていたことあるし。カヅキくんとアイラちゃんとかね","","",""
"17","カヅキ","","ま、恋愛云々はともかくとして。パートナーとの信頼関係を築くためには、一緒に暮らすのは手っ取り早い方法だろ","","",""
"18","シェリー","","こじれたときには、逆に色々と面倒ですが","","",""
"19","","","え……。","","",""
"20","カヅキ","","おいシェリー。今そういうこと言うなよ……","","",""
"21","シェリー","","失礼しました。他意はありません","","",""
"22","","","ヤスタカさんと一緒に暮らすのは、大変なのかな。うん、大変なんだろうな……。","","",""
"23","カヅキ","","アイラとツカサは今、うまくいってるんだから、会社として推奨してるかしてないかは関係ねえ。ふたりが幸せならそれでいいじゃねえか","","",""
"24","ミチル","","いえ、推奨だとしたら、この前カヅキさんが言ってた、社内恋愛禁止ってなんだったんだろうなって……","","",""
"25","カヅキ","","ああ、ありゃ嘘だ","","",""
"26","ミチル","","嘘！？","","",""
"27","","","あ、そっか。あれが単なる方便だっていうのは、俺は説明されたけど、ミチルたちには伝わってないんだっけ。","","",""
"28","ミチル","","なんだ、嘘だったんだ。それならそうと言ってくださいよ……","","",""
"29","カヅキ","","ん？　ミチル、お前そんなに社内恋愛したいのか？","","",""
"30","ミチル","","そ、そういうわけじゃ","","",""
"31","レン","","ははは。恋愛はいいよお、ミチルくん！　毎日がハッピーになるからね！","","",""
"32","レン","","アイラくんもツカサくんも、今、ハッピーだろう？","","",""
"33","アイラ","","うん……","","",""
"34","ツカサ","","そうですね。毎日が楽しいです","","",""
"35","タカオ","","初々しいねぇ","","",""
"36","タカオ","","僕も奥さんと付き合いたての頃は、そんな感じだったんだけどねぇ。今じゃさっぱりだよ","","",""
"37","カヅキ","","へぇ、今の姿からはあんまり想像できねえな……","","",""
"38","タカオ","","あっ、ひどいなぁ～。こう見えても、僕は奥さんからプロポーズされた方だからね？","","",""
"39","タカオ","","結婚してから１年くらいまでは、アツアツでねえ。でも、そういう時期ってのは必ず過ぎていっちゃうものなんだよ……","","",""
"40","","","課長の話に、和やかだった場の雰囲気が、少しずつ重たくなっていく。","","",""
"41","タカオ","","最近なんて、娘が変なカレシを家に連れてきて、もう大変だったんだから","","",""
"42","レン","","大変と言うと？","","",""
"43","タカオ","","僕への挨拶なんてそこそこに、嫁さんと３人で出かけちゃうんだから","","",""
"44","タカオ","","まあ、僕もどんな話をしていいか分からなかったから、助かったと言えば助かったんだけど","","",""
"45","タカオ","","だって、話が通じると思わなくてさあ。頭なんか、こんなにツンツンに立たせちゃってて、鼻にピアスまであけてたんだよ？　参っちゃうよ～","","",""
"46","タカオ","","あんなのと付き合うような娘に育てた覚えは、ないんだけどなあ。嫁さんも嫁さんで、なんであんなに平然と話せるんだろう","","",""
"47","コンスタンス","","課長、その話は、あまり笑えません……","","",""
"48","ザック","","ヘビーすぎだよね","","",""
"49","","","誰もが、話題を変えてくれと内心思ってるに違いない。","","",""
"50","自分から話題を変える","ミチルにアイコンタクトする","",""
"51","ツカサ","","そ、それはそうと！","","",""
"52","","","かなり強引に、話題を戻してみることにした。","","",""
"53","ツカサ","","第１ターミナルサービスでは、過去に社内恋愛って、あったんですか？","","",""
"54","カヅキ","","…………","","",""
"55","シェリー","","…………","","",""
"56","","","なぜか、カヅキさんとシェリーがあからさまに顔をしかめた。","","",""
"57","ツカサ","","あ、あれ？","","",""
"58","シェリー","","ツカサ、その話題はやめておいた方が身のためです","","",""
"59","ツカサ","","えっ？　ええっ？","","",""
"60","ミチル","","それって、ヤスタカさんがなにか関係してるの？","","",""
"61","シェリー","","していると言えば、しています","","",""
"62","カヅキ","","シェリー、それ以上はよせ","","",""
"63","シェリー","","し、失礼しました","","",""
"64","","","あのシェリーが、今、一瞬だけど、カヅキさんに怯んだぞ。","","",""
"65","","","いったいなにがあったんだ……。\nすごく聞きたいけど、踏み込んじゃいけない空気がプンプンとする。","","",""
"66","ザック","","っていうかさ、ヤスタカの場合、社内恋愛どころか、社内だろうが社外だろうがお構いなく、って感じでしょ","","",""
"67","タカオ","","そうだねえ。ヤスタカくんは昔からあんな感じだよ","","",""
"68","シェリー","","……仕事に影響が出ない程度にとどめてもらいたいものですが、おそらく無理でしょうね","","",""
"69","カヅキ","","無理だろうなあ。あいつは本当にどうしようもない","","",""
"70","レン","","なまじ、仕事はできますからね","","",""
"71","カヅキ","","そうなんだよなあ。なあシェリー、いっそヤスタカと付き合って、尻に敷いちまえよ。それで徹底的に調教してやれ","","",""
"72","シェリー","","お断りします","","",""
"73","カヅキ","","お前だってその方が楽になるだろ","","",""
"74","シェリー","","いいえ。お断りします","","",""
"75","カヅキ","","会社のためを思ってさ","","",""
"76","シェリー","","それ以上言うと、カヅキの恋愛遍歴をここでバラします","","",""
"77","カヅキ","","悪かった。本当にすまん","","",""
"78","","","カヅキさんがものすごい勢いで頭を下げた。","","",""
"79","","","だから、いったいカヅキさんの過去になにがあったの！？","","",""
"80","","","俺はミチルにアイコンタクトを送って、救いを求めた。","","",""
"81","ミチル","","そ、そう言えば！","","",""
"82","","","それを受けて、ミチルが動いた。","","",""
"83","ミチル","","私、この間、噂で聞いたんですよ。エルの恋愛話について","","",""
"84","ミチル","","実はエルって、年上が好きらしいですよ","","",""
"85","ツカサ","","へ、へえ！　年上ってどれくらいの？","","",""
"86","ミチル","","たとえば……オヤジさんくらいだって言ってた","","",""
"87","ツカサ","","え！？","","",""
"88","レン","","ずいぶん上だねえ","","",""
"89","ザック","","エルって、ギフティアにしか興味がないと思ってた","","",""
"90","ツカサ","","そもそも、オヤジさんって結婚してるんですかね？","","",""
"91","タカオ","","オヤジさんについては、プライベートは謎なんだよ～","","",""
"92","アイラ","","私も、知らない","","",""
"93","コンスタンス","","言葉には出さず、背中で語る、という感じですね。職人気質なんでしょう","","",""
"94","コンスタンス","","そういう意味では、男らしい人ですよ","","",""
"95","","","それにしても、エルさんの守備範囲の広さは凄まじい……。","","",""
"96","カヅキ","","で、話は戻るが、ミチルはカレシ作らないのか？","","",""
"97","ミチル","","なっ！？　またその話ですか？","","",""
"98","コンスタンス","","ミチルからは、浮いた話はまるで聞きませんね","","",""
"99","ザック","","男の影も形もなくて、逆に心配になるよ","","",""
"100","ミチル","","ザック！　なに言ってんのよ！","","",""
"101","カヅキ","","うーん、なんでカレシができないんだろうな","","",""
"102","シェリー","","ミチルはとても素晴らしい女性だと思います。家庭的ですし、気が利きますし、面倒見もいいですから","","",""
"103","カヅキ","","これ以上の好物件はなかなかねえよなあ","","",""
"104","ミチル","","人を物件扱いしないでくださいよ……","","",""
"105","ザック","","そもそも理想が高すぎるんじゃない？","","",""
"106","ミチル","","ぐ……","","",""
"107","アイラ","","白馬の王子様が迎えにくるのを待ってるって、前に言ってた","","",""
"108","ミチル","","キャアアア！　アイラ、言っちゃダメ！","","",""
"109","コンスタンス","","なるほど","","",""
"110","カヅキ","","なるほどなあ","","",""
"111","レン","","ははは、なるほど","","",""
"112","ミチル","","納得しないでください！","","",""
"113","ミチル","","そもそも、私には仕事がありますから！","","",""
"114","タカオ","","ミチルちゃん、もしかしてワーカーホリックなの？　少し休んで、素敵なボーイフレンドを見つけたら？","","",""
"115","ミチル","","大丈夫ですってば","","",""
"116","ザック","","そのわりには女性誌のデート特集とか読んでるよね～","","",""
"117","ミチル","","！？","","",""
"118","","","ミチルって、けっこう致命的に隙が大きいよね。\nとにもかくにもザックをちゃんと口止めしておくのが、今後ミチルが平穏に暮らしていく上で一番大事なような気がする。","","",""
"119","ミチル","","そ、それはそれよ！　いざっていうときに、ツカサみたいにアタフタしたくないの！","","",""
"120","ツカサ","","待った、ミチル。俺、これでもいろんなマニュアル本を読んでたから","","",""
"121","ツカサ","","女性誌を読んで勉強しても、あんまり意味ないと思うよ","","",""
"122","ミチル","","え、そうなの！？","","",""
"123","ツカサ","","うん、結局、いざっていうときは頭で考える余裕なんてないから。気を付けた方がいいよ","","",""
"124","ミチル","","分かった……覚えとくわ","","",""
"125","アイラ","","ふふっ","","",""
"126","","","と、アイラがおかしそうに噴き出す。","","",""
"127","アイラ","","確かにツカサ、すごく変な時期があった","","",""
"128","アイラ","","デートに誘ってくれたときや、最初に寮で一緒に暮らすことになったときも","","",""
"129","アイラ","","すごく必死な感じだったよね","","",""
"130","","","アイラを振り向かせるのは大変だったんだ……。","","",""
"131","アイラ","","でも、それだけ、私のことを思ってくれてたってことなので。……今振り返ってみると、嬉しい","","",""
"132","ツカサ","","アイラ……","","",""
"133","カヅキ","","…………","","",""
"134","","","って、なんかカヅキさんににらまれてるんだけど！？","","",""
"135","コンスタンス","","ははは。カヅキ、ツカサへの嫉妬は大人げないですよ","","",""
"136","カヅキ","","う、うるせえ","","",""
"137","","","と、カヅキさんは時計を確認する。","","",""
"138","カヅキ","","っと、そろそろ昼休み終わりだぞ。お前ら仕事しろー","","",""
"139","","","カヅキさんの一言で、皆が仕事に戻る。","","",""
"140","アイラ","","…………","","",""
"141","","","俺も自分の机に戻って、書類とにらめっこを始めようとしたんだけど、そこでふと視線を感じて顔を上げた。","","",""
"142","","","正面に座るアイラが、俺を見てニコニコしていた。","","",""
"143","","","なんだか嬉しそうだ。","","",""
"144","","","いつも通りであるっていうこと。","","",""
"145","","","アイラが望んでいた、穏やかで幸せな日々には、こうして会社のみんなと、何気ないことを語り合うのも含まれているのかもしれない。","","",""
