"0","ツカサ","","ふあぁ……","","",""
"1","","","寮の窓際で大きなあくびをする。","","",""
"2","","","今日は、仕事は休みにした。","","",""
"3","","","アイラとふたりきりでゆっくり過ごしたかったんだ。","","",""
"4","アイラ","","おはよう、ツカサ","","",""
"5","","","アイラがシャワーから上がり、俺の立つ窓際へとやってくる。","","",""
"6","","","隣に立ったアイラからは、ほのかに良い香りが漂ってきた。","","",""
"7","ツカサ","","おはよう","","",""
"8","アイラ","","ツカサ、まだ眠そう","","",""
"9","ツカサ","","そんなことないよ。ほら、この通り！","","",""
"10","","","俺はわざとおどけて、その場で何度かスクワットをして見せた。","","",""
"11","ツカサ","","ねえ、アイラ。後で、ちょっと出かけてみようよ","","",""
"12","アイラ","","うん。いいよ","","",""
"13","アイラ","","どこか行きたい場所があるの？","","",""
"14","ツカサ","","いや、そういうわけじゃないんだけどさ。あてもなく出かけるっていうのも、いいものだよ","","",""
"15","","","この寮のすぐ隣には、小さな公園だってあるし。\nそこを散歩するだけでも、気持ちよさそうな陽気だ。","","",""
"16","アイラ","","そうだね。私も前は、よく近くを散歩した","","",""
"17","ツカサ","","じゃあ、アイラは散歩のベテランだね。このあたりの道は知り尽くしてる？","","",""
"18","アイラ","","…………","","",""
"19","ツカサ","","あ、ごめん。そう言えばアイラは、方向音痴だったっけ……","","",""
"20","アイラ","","ち、違うよっ。地図はばっちり頭に入ってるので","","",""
"21","ツカサ","","そ、そっか。ごめんごめん","","",""
"22","アイラ","","あ、信じてない","","",""
"23","ツカサ","","信じてるって。うん","","",""
"24","","","俺はアイラからの抗議の言葉を笑って受け流して、朝食を作るためにキッチンへ向かった。","","",""
"25","","","朝食を食べ終えてから、ふたりで散歩に出かけた。","","",""
"26","","","ひとまずは、寮のすぐ隣にある小さな公園へ。","","",""
"27","ツカサ","","うーん、気持ちいい！","","",""
"28","","","空から柔らかい日差しが降り注いでいる。","","",""
"29","アイラ","","もうすぐ、本格的な夏になりそうだね","","",""
"30","","","ちょうどベンチがあったから、そこで日向ぼっこをすることにした。","","",""
"31","","","しばらく、ふたりの間に沈黙が流れる。特に話す必要も感じない。\nただ、こうして一緒に寄り添って座っている。それだけで満足だ。","","",""
"32","","","遊園地のベンチでもそうだったけど。こうしてのんびり過ごすことって、アイラと出会うまであまりなかった気がする。","","",""
"33","","","こんな素敵な時間の過ごし方をできるのは、つまり、アイラのおかげっていうことだね。","","",""
"34","アイラ","","あったかいね","","",""
"35","ツカサ","","うん","","",""
"36","","","ちょうどいい感じに木陰があるおかげで、適度に涼しかった。","","",""
"37","","","と、アイラが俺の肩に頭をもたせかけてきた。","","",""
"38","","","アイラの横顔を見ると、穏やかな表情をして目を閉じていた。","","",""
"39","ツカサ","","寝ちゃいそうだね","","",""
"40","アイラ","","寝ないよ。でも、しばらくこうしていたい","","",""
"41","ツカサ","","俺の肩でよければ、いくらでもどうぞ","","",""
"42","アイラ","","…………","","",""
"43","ツカサ","","…………","","",""
"44","","","アイラの横顔に、見とれてしまう。","","",""
"45","","","愛しい人。","","",""
"46","","","柔らかそうな頬や唇。","","",""
"47","","","揺れる髪から漂う、シャンプーの香り。","","",""
"48","","","抱きしめたくなってしまう。","","",""
"49","","","と、アイラがわずかに身じろぎして、目を開けた。","","",""
"50","アイラ","","どうしたの？","","",""
"51","ツカサ","","いや、なんでもないよ","","",""
"52","アイラ","","そうかな？　今、すごく見てたけど","","",""
"53","ツカサ","","秘密","","",""
"54","アイラ","","言わないなら……","","",""
"55","アイラ","","えいっ","","",""
"56","","","アイラが突然、俺の脇腹をくすぐってきた。","","",""
"57","ツカサ","","わ、ちょ、ちょっと……！","","",""
"58","アイラ","","ほら、くすぐられたくなかったら白状して","","",""
"59","ツカサ","","わはは、やめ、うひひ……！","","",""
"60","アイラ","","ツカサ、まだ言わないの～？","","",""
"61","ツカサ","","言う！　言うから！","","",""
"62","アイラ","","本当に～？","","",""
"63","ツカサ","","本当だって……！","","",""
"64","アイラ","","じゃあ、やめてあげる","","",""
"65","","","アイラはようやく、くすぐるのを止めてくれた。","","",""
"66","ツカサ","","はぁはぁ……はあ……","","",""
"67","アイラ","","さあ、教えて。どうして見てたの？　私の顔になにかついてた？","","",""
"68","ツカサ","","そうじゃなくて……","","",""
"69","ツカサ","","アイラに、見とれてたんだ","","",""
"70","アイラ","","えっ","","",""
"71","アイラ","","そ、そう……。それは、どうも","","",""
"72","ツカサ","","うん","","",""
"73","ツカサ","","っていうか、白状させたのに、アイラが照れてどうするの？","","",""
"74","アイラ","","ツカサが、正直に言うので","","",""
"75","","","アイラは、うつむいて自分の顔を隠すようにしつつ、また俺の肩に頭をもたせかけてきた。","","",""
"76","アイラ","","しばらく、顔見ちゃダメ","","",""
"77","ツカサ","","どうして？","","",""
"78","アイラ","","照れてるので","","",""
"79","ツカサ","","うん、分かった","","",""
"80","","","俺は改めて、公園を見回した。","","",""
"81","","","公園には、小さな噴水もあった。そこでは何人かの子どもたちが集まり、キャッキャと歓声を上げながら水遊びをしている。","","",""
"82","アイラ","","夏って好き？","","",""
"83","ツカサ","","好きだよ。気分が明るくなるしね","","",""
"84","アイラ","","子どものころ、水遊びした？","","",""
"85","","","アイラも、俺と同じものを見ていたみたい。","","",""
"86","ツカサ","","もちろん。友達と近くのプールとか、水場とかで","","",""
"87","アイラ","","そうなんだ。わんぱくだったんだね","","",""
"88","ツカサ","","水遊び、気持ちよさそう。俺、だんだんうずうずしてきたよ","","",""
"89","アイラ","","子どもみたい","","",""
"90","ツカサ","","行ってみない？","","",""
"91","アイラ","","しょうがないから、わんぱくなツカサに付き合ってあげる。ふふ","","",""
"92","ツカサ","","お願いします、アイラおねえさん","","",""
"93","アイラ","","わぁ。この噴水、すごく水が綺麗だよ。ほら、近くで見てみて","","",""
"94","","","噴水の中を覗き込むアイラに言われ、俺も同じ行動をとる。","","",""
"95","","","と、その瞬間。","","",""
"96","アイラ","","えいっ！","","",""
"97","ツカサ","","うわわっ！","","",""
"98","","","アイラが水を手ですくい、俺の顔にかけてきた。","","",""
"99","","","なかなかの冷たさに、俺は思わず尻もちをついてしまう。","","",""
"100","ツカサ","","いててて……","","",""
"101","アイラ","","油断大敵だよ","","",""
"102","ツカサ","","びっくりした～","","",""
"103","正攻法で反撃","油断したところに反撃","",""
"104","","","でも、俺だってやられてばかりじゃいられない。\nこっちも反撃だ。","","",""
"105","ツカサ","","それっ！","","",""
"106","アイラ","","ふふ、ツカサの行動くらい読めてるので","","",""
"107","ツカサ","","なら、今度こそ！","","",""
"108","アイラ","","きゃっ！","","",""
"109","","","俺の連続攻撃を、アイラはよけきれなかった。","","",""
"110","ツカサ","","行動を読んでたんじゃなかった？","","",""
"111","アイラ","","連続は卑怯……","","",""
"112","","","俺は立ち上がって、あたかも腰が痛いといったように前傾姿勢になる。","","",""
"113","アイラ","","ツカサ？　もしかして腰、痛めちゃった？　大丈夫？","","",""
"114","","","アイラは申し訳なさそうに、そんな俺の顔を覗き込んできた。","","",""
"115","","","ここだ！","","",""
"116","ツカサ","","それっ！","","",""
"117","アイラ","","きゃっ！","","",""
"118","","","俺はさきほどのお返しにアイラの顔めがけて水を飛ばす。","","",""
"119","アイラ","","騙された……","","",""
"120","ツカサ","","あはは、お返し","","",""
"121","アイラ","","むー……なら、お返しのお返し！","","",""
"122","","","アイラが再び俺の顔に水をかけてくる。","","",""
"123","ツカサ","","はは、やったな！","","",""
"124","","","それに俺も水をかけかえす。","","",""
"125","","","ばちゃばちゃとまきあげられた水しぶきが輝く。","","",""
"126","","","ひとしきり、水をかけ合った後は、子どもたちが集まっている人工の小川へと移動した。","","",""
"127","","","くるぶしぐらいまでの深さしかないから、子どもたちも裸足になって水に浸かっている。","","",""
"128","","","俺とアイラも、それに倣うことにした。","","",""
"129","ツカサ","","うひー！","","",""
"130","アイラ","","くぅ、冷たい……！","","",""
"131","","","水自体はとても冷たい。","","",""
"132","","","でも、アイラは楽しそうだ。","","",""
"133","","","周囲にいた子どもたちの輪に混ざって、水面を蹴ったり、おもちゃのアヒルを浮かべたりと、無邪気に楽しんでいる。","","",""
"134","","","ついには、子どものひとりから、水鉄砲のようなものを受け取って。","","",""
"135","アイラ","","ツカサ！　ツカサ！","","",""
"136","","","……え、水鉄砲？","","",""
"137","アイラ","","発射！","","",""
"138","ツカサ","","うわっ、つめてっ！","","",""
"139","","","アイラが水鉄砲から発射した水が、勢いよく俺のお腹あたりにかかった。服が派手に濡れてしまった。","","",""
"140","アイラ","","どう？","","",""
"141","ツカサ","","アイラだけずるいよ","","",""
"142","","","せめて反撃したいけど、水鉄砲のストックはもうないらしい。","","",""
"143","アイラ","","ふふっ、ツカサ、手をあげろー","","",""
"144","ツカサ","","分かった分かった。降参します","","",""
"145","","","俺はあっさりと降参し、両手を挙げた。","","",""
"146","アイラ","","ふふふ","","",""
"147","ツカサ","","……って、アイラ？","","",""
"148","アイラ","","発射ー！","","",""
"149","ツカサ","","ひゃあ、つめたっ！","","",""
"150","","","今度は顔面に水をかけられた。","","",""
"151","ツカサ","","降参したのにー！","","",""
"152","アイラ","","あはははは","","",""
"153","","","アイラは、無邪気に笑いながらどんどん水を発射してくる。","","",""
"154","","","このままじゃ、全身びしょ濡れで、散歩どころじゃなくなっちゃうぞ！","","",""
"155","","","いや、まあ、寮はすぐ隣だから、帰って着替えるのなんてすぐなんだけど。","","",""
"156","ツカサ","","アイラ、タイムタイム！","","",""
"157","アイラ","","ツカサ、逃げちゃダメだよ","","",""
"158","","","子どもたちが、アイラの一方的な攻撃を見て楽しそうに歓声を上げる。それでアイラは完全に火がついちゃったみたいだ。","","",""
"159","アイラ","","止まらないと、撃つので！","","",""
"160","ツカサ","","止まってるけど撃ってるからー！","","",""
"161","","","俺の訴えもむなしく、水鉄砲は撃たれ続ける。","","",""
"162","","","途中、水鉄砲内の水が切れて補充し始めたから、その隙にアイラにそーっと近づこうとしたんだけど。","","",""
"163","","","そうしたら、周りの子どもたちがアイラをしっかりガードして、俺を近づかせなかった。","","",""
"164","","","というわけで俺はそれから３０分ほど、アイラから一方的な水の的になり続けた。","","",""
"165","","","アイラがすごく楽しそうだったから、俺もあえて強く抵抗はしなかった。こうやって童心に戻るのも、たまにはいいよね。","","",""
