"","","先日買ったトレーニングウェアを着て、俺がロフトから階下へ降りていくと、アイラがすぐにそれに気付いた。","","",""
"アイラ","","もしかして、ついにダイエットを始めるの？","","",""
"ツカサ","","そういうこと。せっかく買ったこのウェアを無駄にしないためにもね","","",""
"アイラ","","じゃあ、私も付き合う","","",""
"アイラ","","この日のために、レンからダイエットの方法も聞いてきたので","","",""
"ツカサ","","え？　本当？　それは頼もしいな","","",""
"","","それじゃあお言葉に甘えて、アイラにトレーナーをしてもらおう。","","",""
"アイラ","","具体的には、どんなダイエットをするつもり？","","",""
"ツカサ","","ジョギングに行くつもり。いきなり長距離は無理だけど、１時間ぐらい近所を走るだけでもかなりの運動になるでしょ","","",""
"アイラ","","うん、いいと思う","","",""
"アイラ","","でも、出かける前に、ストレッチしていった方がいいよ","","",""
"ツカサ","","ストレッチか。なるほど","","",""
"","","運動の前に適度に筋肉をほぐしておけば、運動中の怪我の危険性がかなり減るって、以前俺もレンさんから教えてもらったことがある。","","",""
"","","アイラはクローゼットからヨガマットを引っ張り出してきて、床に敷いた。","","",""
"ツカサ","","それ、どうしたの？","","",""
"アイラ","","昔、カヅキが買ったの。でもほんの数回しか使わずに、ずっと置きっぱなしになってた","","",""
"アイラ","","ちょうどいいから、使って","","",""
"ツカサ","","助かるよ","","",""
"アイラ","","ストレッチのやり方、ツカサは知ってる？","","",""
"ツカサ","","なんとなくしか分からないなあ","","",""
"アイラ","","柔軟運動をすることで、筋肉をほぐして身体を柔らかくするの","","",""
"アイラ","","走りに行く前に、１５分くらいでいいからやっておくといいんだって","","",""
"","","アイラは俺の前に、向かい合う形で立った。","","",""
"アイラ","","それじゃ、私が実践するから、ツカサはついてきて","","",""
"ツカサ","","お願いします、コーチ","","",""
"アイラ","","まずは、首のストレッチから","","",""
"","","アイラはぐるんぐるんと頭をゆっくりと回した。\n俺もそれを真似する。","","",""
"アイラ","","次は腕","","",""
"アイラ","","ストレッチ中はね、呼吸が大事なんだって","","",""
"アイラ","","大きく吸って、大きく吐くの。それに合わせて、身体を動かすの","","",""
"ツカサ","","なるほど","","",""
"","","腕のストレッチを何パターンかやったあと、アイラはその場に座り込んだ。俺もそれに倣って腰を降ろす。","","",""
"","","そこから、背中や足のストレッチに入る。","","",""
"アイラ","","ツカサ、けっこう身体が固いね","","",""
"ツカサ","","そうなんだよね。続けていれば、柔らかくなるかな？","","",""
"アイラ","","うん。なるって言ってた","","",""
"","","単なる柔軟体操だけど、時間をかけてじっくりやっていると、額に少し汗がにじむぐらいの運動にはなった。","","",""
"ツカサ","","ありがとう、アイラ。コーチとして優秀だね","","",""
"アイラ","","ツカサの役に立ててよかった","","",""
"","","と、アイラは立ち上がって、クローゼットから今度は大きなボールを引っ張り出してきた。","","",""
"アイラ","","次はこれを使おう。これで、体幹トレーニングをする","","",""
"ツカサ","","バランスボール？　それもカヅキさんが買ったの？","","",""
"アイラ","","うん。カヅキは、１回使ったきりで、飽きちゃった","","",""
"ツカサ","","俺、バランスボールって使ったことないんだよね。それもレンさんからなにかレクチャーされた？","","",""
"アイラ","","“基本姿勢で座ったら、力を抜いて、体重を預ける。怖がっていると余計に安定しない”って","","",""
"アイラ","","“あとはお尻でバランスを取って、足を床に付けないようにするだけ”","","",""
"ツカサ","","そっか。じゃあ、やってみよう","","",""
"","","俺は恐る恐るバランスボールへと腰を下ろした。\n足を床から離し、お尻だけでバランスを取る。","","",""
"アイラ","","それが基本姿勢だって。そこから、上体を倒してみて","","",""
"ツカサ","","よっと……","","",""
"","","俺は少しずつ上体を倒していった。そこから、バランスボールの上で腹筋をするように再び身体を起こしていく。","","",""
"","","転げ落ちないようにバランスを取りながらだと、かなりキツイぞ。","","",""
"ツカサ","","くっ……！","","",""
"アイラ","","ツカサ、頑張って！　ほら、あと少し！","","",""
"ツカサ","","くぅぅっ……！　だ、ダメ……かも……！","","",""
"アイラ","","ツカサ、そんなんじゃいいスポッターになれないので！","","",""
"ツカサ","","はぁはぁ……","","",""
"","","アイラの言葉に驚きつつも、なんとか俺は起き上がることができた。","","",""
"ツカサ","","ええと、いいスポッターってなに？　急にどうしたの？","","",""
"アイラ","","厳しいコーチ役をやればツカサも頑張るはずって、レンに教えてもらった","","",""
"ツカサ","","レンさん、考え方が体育会系だなあ……","","",""
"ツカサ","","っていうかバランスボールって、こんなにキツイものだったんだね","","",""
"アイラ","","“苦しみの先にこそ減量はある！”って。これもレンが言ってた","","",""
"ツカサ","","あはは……","","",""
"","","っていうか、これってまだストレッチの段階なんだよね。\nこれから１時間のジョギングに出かけなくちゃいけないと思うと、すでに心が折れそう。","","",""
"アイラ","","はい、使って","","",""
"","","アイラが渡してきたのはスポーツタオルだった。","","",""
"","","気がつくと、俺の額はすっかり汗びっしょりだ。","","",""
"ツカサ","","ありがとう。助かるよ","","",""
"アイラ","","ツカサがジョギングに出かけたら、スポーツドリンクを作って、どこかで差し入れするね","","",""
"アイラ","","作り方、レンに教わったので","","",""
"","","そこまでしてくれるなんて、本当にありがたい。","","",""
"ツカサ","","なんだか、部活のマネージャーみたいだね","","",""
"アイラ","","ふふっ、ツカサだけのマネージャー兼鬼コーチだよ","","",""
"","","俺だけのマネージャーか。アイラが応援してくれるなら、やる気が出そうだ。","","",""
"","","鬼コーチっていうのは、聞かなかったことにする。","","",""
"","","とりあえず、バランスボールでもう少し運動をしておこう。\n俺は腹筋運動を再開した。","","",""
"ツカサ","","くぅ……ふぅ……！","","",""
"","","数度の腹筋運動をしただけで、ヘロヘロになってしまう。","","",""
"ツカサ","","はぁ、はぁ","","",""
"","","基本姿勢になって、少し休憩。\nと、アイラが近寄ってきた。","","",""
"アイラ","","鬼コーチの登場なので～","","",""
"","","言うなり、おもむろに俺の肩あたりを軽く押してきた。","","",""
"ツカサ","","わっ、とととっ","","",""
"","","とっさのことに、俺はバランスボールの上で姿勢を崩す。\n必死に踏ん張ってみたけど――。","","",""
"","","結局、奮闘虚しく床へと倒れこんでしまった。","","",""
"ツカサ","","アイラ、急に押すなんてひどいよ……","","",""
"アイラ","","ツカサ、まだまだ修行が足りないね","","",""
"","","アイラはそう言って、いたずらげな笑みを浮かべる。","","",""
"ツカサ","","だったら、アイラにお手本を見せてほしいな","","",""
"アイラ","","え！？","","",""
"","","あ、予想外のことを言われて明らかに動揺してる。","","",""
"ツカサ","","鬼コーチ、ぜひお願いします","","",""
"アイラ","","わ、わかった。やってみる","","",""
"","","てっきり断ってくるかと思ったけど、意地になっているのか、アイラは俺の頼みを受けて、バランスボールと対峙した。","","",""
"","","そーっとそーっと、恐る恐るっていう様子でバランスボールの上に腰を下ろして、ゆっくりと床から足を離すと――。","","",""
"アイラ","","きゃっ！","","",""
"","","すぐにひっくり返ってしまった。","","",""
"ツカサ","","…………","","",""
"アイラ","","…………","","",""
"","","アイラは少し涙目になりながら、無言で立ち上がる。","","",""
"","","き、気まずい……。","","",""
"代わろうか？","支えようか？","","","dummy","dummy"
"ツカサ","","えっと、か、代わろうか？　お手本は、もういいから……","","",""
"アイラ","","そういうわけには、いかない","","",""
"アイラ","","だって、私はツカサのマネージャー兼鬼コーチなので","","",""
"","","すっかり意固地になっちゃってる。","","",""
"","","アイラは再びバランスボールに腰かけた。","","",""
"アイラ","","ふぁっ","","",""
"","","でもすぐに床に転がされてしまう。","","",""
"アイラ","","しゅわっ","","",""
"アイラ","","おふっ","","",""
"アイラ","","りゃぁっ","","",""
"","","何度挑戦してみても、結果は変わらなかった。\nそもそも基本姿勢にすらなれない。","","",""
"","","熱意は買うし、俺のために一生懸命やってくれるのは嬉しいけど。\nこれじゃ、いつまで経っても進まない。","","",""
"","","あ、そうだ！","","",""
"ツカサ","","じゃあ、俺がバランスボールに座って、アイラが俺の膝に座るっていうのは？","","",""
"アイラ","","……ツカサ、ふざけないで","","",""
"アイラ","","ストレッチは、真面目にやるべき","","",""
"ツカサ","","あ、すみません……","","",""
"","","怒られてしまった……。","","",""
"ツカサ","","でも、ちょっとやってみたいかも、って思わなかった？","","",""
"アイラ","","…………","","",""
"アイラ","","お、思わない、ので……","","",""
"ツカサ","","ちょっと迷ったよね、今","","",""
"アイラ","","迷ってないもん","","",""
"アイラ","","ツカサ、私が基本姿勢になるのを手伝って","","",""
"ツカサ","","え？","","",""
"アイラ","","ちゃんとマスターするまで、練習する","","",""
"ツカサ","","い、いいけど……","","",""
"ツカサ","","えっと、よ、よかったら、支えようか？","","",""
"アイラ","","そうして……","","",""
"","","アイラは素直にうなずいた。","","",""
"","","バランスボールに再びアイラが腰かける。\n俺はすぐ横に立ち、アイラの片手を持って支えてあげることにする。","","",""
"アイラ","","ツカサ、離さないでね","","",""
"ツカサ","","大丈夫。安心して","","",""
"アイラ","","…………","","",""
"","","アイラはごくりと息を呑むと、そろりと床から足を離した。","","",""
"アイラ","","くっ……","","",""
"","","バランスボールの上で、アイラの身体はぐらぐらと揺れている。","","",""
"","","それでも、俺が支えてあげているおかげもあって、今度はひっくり返らなかった。","","",""
"アイラ","","……や、やった","","",""
"アイラ","","ツカサ、見た？　私、乗れてる！","","",""
"ツカサ","","うん。いい感じだよ","","",""
"アイラ","","ふふ、これが、私の実力なので","","",""
"","","どうやらすっかり機嫌は直ったみたいだ。\nそれどころか、無邪気に笑って喜んでいる。\nそんなアイラの素直な表情に、俺まで嬉しくなった。","","",""
"ツカサ","","さすがは鬼コーチだね","","",""
"ツカサ","","じゃあ、そのまま腹筋をしてみよう","","",""
"アイラ","","え、ええっ！？","","",""
"アイラ","","それは……ちょっと","","",""
"ツカサ","","ということは、アイラもまだまだ修行が足りないのかな？","","",""
"","","わざとらしくそう指摘してみたら、アイラはまたムッとした。","","",""
"アイラ","","腹筋ぐらい、できるので……！","","",""
"","","負けず嫌いだけあって、アイラはすぐさま挑戦を始めた。","","",""
"","","上体をゆっくりと寝かせて、それから起こす。\nその間も、片手は俺の手を握ったままだ。","","",""
"","","アイラは全身をプルプルさせながらも、腹筋を繰り返した。","","",""
"アイラ","","ど、どう？","","",""
"ツカサ","","すごい。うまくできてる","","",""
"アイラ","","でしょう？","","",""
"","","アイラは勝ち誇り、胸を張った。その途端にあっさりバランスを崩して――。","","",""
"アイラ","","ひゃあっ！","","",""
"ツカサ","","わっ","","",""
"","","俺の手をつかんでいるのに、アイラはひっくり返ってしまった。","","",""
"ツカサ","","あはは、そろそろ交代しようか","","",""
"アイラ","","……ダメ","","",""
"ツカサ","","へ？","","",""
"アイラ","","このままじゃ、鬼コーチの名がすたるので。ちゃんとマスターするまで、練習する","","",""
"アイラ","","ツカサ、付き合って","","",""
"ツカサ","","い、いいけど……","","",""
"","","これって、もともとは俺がジョギングに行く前のストレッチだったよね……。","","",""
"","","すっかり目的がすり替わっちゃってるなあ。\n今日のところは、走りに行くのはお預けにした方がよさそうだ。","","",""
"","","その後、アイラがバランスボールに慣れるまで、俺も付き合って２時間近くも汗を流した。","","",""
"","","ダイエットにはならなかったけど、いい運動にはなったから、よしとしよう。","","",""
