"","","朝。目覚ましのアラーム音で目を覚ました俺は、ベッドから身を起こした。","","",""
"ツカサ","","…………","","",""
"","","あくびを噛み殺しつつ、ロフトから階段を降りていく。","","",""
"","","ちょうどアイラがトイレから出てきたところだった。","","",""
"ツカサ","","アイラ、おはよう","","",""
"アイラ","","おはよう","","",""
"ツカサ","","……！","","",""
"","","え、今、なんて……！？","","",""
"ツカサ","","お、おはよう！","","",""
"アイラ","","……？","","",""
"アイラ","","おはよう","","",""
"ツカサ","","うおおお、おはよう！　おはよう！　おっはよーう！","","",""
"アイラ","","……？","","",""
"ミチル","","ツカサ、朝っぱらからうるさーい！","","",""
"","","すっかり興奮してひとりで騒いでいたら、隣からミチルがいつものように怒鳴り込んできた。","","",""
"ツカサ","","聞いてよミチル！　今、おはようって！　アイラが！","","",""
"ミチル","","はあ？","","",""
"ツカサ","","やった！　俺感動しちゃった！","","",""
"","","ところが、当のアイラは俺の興奮なんて他人事のように、着替えをはじめているところで。","","",""
"ミチル","","って、着替え中じゃないの！","","",""
"ミチル","","あんたは表に出てろー！","","",""
"","","ミチルが急にすごい剣幕で怒ってきて、俺は部屋から追い出されてしまった。","","",""
"ツカサ","","はは……ははは……","","",""
"","","俺はそれでも、ガッツポーズを取るくらいにはテンションが上がったままだった。","","",""
"","","アイラが、部屋にいるときに、挨拶を返してくれたんだ。\nそんな些細なことなのに、すごく嬉しかった。","","",""
"","","昨日、一緒にデートして、先に帰られたときには本気で絶望したけど。","","",""
"","","結果的に、あれがきっかけでなにかが変わったような。そんな気がする。","","",""
"ツカサ","","…………♪","","",""
"ミチル","","…………ツカサ","","",""
"ツカサ","","…………♪","","",""
"ミチル","","……ツ・カ・サ","","",""
"ツカサ","","え？","","",""
"ミチル","","あんたね、アイラの着替え姿を思い出してニヤニヤしてんじゃないわよ。気持ち悪い","","",""
"ツカサ","","そんなんじゃないって！","","",""
"ツカサ","","っていうか、俺、今、ニヤニヤしてた？","","",""
"ミチル","","思いっきり、してた","","",""
"ザック","","そう言えばこの前、ツカサが変な本を読んでるのを見かけたけど","","",""
"ミチル","","変な本？","","",""
"ザック","","なんだったっけ。あ、そうそう、『ラブラブ新婚生活マニュアル』とかなんとか。あれ、『デートマニュアル』だったかな？","","",""
"ツカサ","","う、うわああ！","","",""
"","","誰にも見られないようにかなり警戒してたのに、どこで見られてたんだ！？","","",""
"ミチル","","……どういうこと？","","",""
"ツカサ","","いや、か、買ったけど、参考にならなかったし！","","",""
"ミチル","","アイラ、こんな奴と一緒で本当に大丈夫なの！？","","",""
"アイラ","","ツカサなら、平気なので","","",""
"ミチル","","え……","","",""
"ツカサ","","ア、アイラ……","","",""
"ミチル","","あ、そ、そう？","","",""
"ミチル","","アイラがいいって言うなら、別に、いいんだけど","","",""
"","","なんだろう、今の一言で、涙が出そうなくらい感激した……。","","",""
"ミチル","","ツ、ツカサ！　あんた机ぐらい少しは整理したらどうなの！？","","",""
"ツカサ","","えっ、机！？","","",""
"","","言われた通り、整理整頓ができていなかった。","","",""
"ミチル","","そうよっ。ニヤついてる暇があったら、それぐらいしゃんとしなさいよっ","","",""
"ツカサ","","ごめん！　すぐにやるよ！","","",""
"ミチル","","フン","","",""
"","","と、カヅキさんがホワイトボードの前に立った。","","",""
"カヅキ","","おーし、今週の仕事割り振るぞ～","","",""
"","","第１ターミナルサービスでは、週に一度、こんな緩い感じでミーティングが開かれる。","","",""
"","","販売されたギフティアが回収まで残り１ヶ月を切ると、本社はそのギフティアを回収対象としてリストアップし、各地域のターミナルサービスへと情報を送ってくるんだけど。","","",""
"","","どの回収対象を、どのコンビが担当するのか。\nそれを決めるのが、このミーティングだった。","","",""
"","","と言っても、決めるのはほぼ、カヅキさんの一存だ。\nコンビごとの特性と、回収対象・所有者との相性を考慮して決めているって聞いた。","","",""
"","","カヅキさんは、ホワイトボードに７枚のギフティアの顔写真を貼り付けていく。","","",""
"","","第１ターミナルサービスが管轄する区域内で、今週新たに回収対象となったのは、その７人っていうことになる。","","",""
"","","レンさんが、各回収対象の情報をまとめたファイルを僕ら全員に配ってくれた。","","",""
"","","今時、紙のファイルに出力して配るなんて、かなりアナクロだけど。これがターミナルサービスの伝統らしい。特にこだわりがあってそうしているわけでもないらしいけど。","","",""
"カヅキ","","今週の新規案件は７件だ","","",""
"カヅキ","","ミチル、お前はミネルバとカールを担当しろ。ミネルバのオーナーが厄介そうだから気を付けとけよ","","",""
"ミチル","","げげー。ロシアの外交官かあ","","",""
"レン","","ザックくんなら、ロシア語は大丈夫だろう？","","",""
"ザック","","ペラペラだよ。すぱしーば","","",""
"カヅキ","","で、ヤスタカには……って、おいシェリー。ヤスタカは？","","",""
"シェリー","","連絡が付きません","","",""
"カヅキ","","またかよ","","",""
"シェリー","","担当分については、私からヤスタカに伝えます","","",""
"カヅキ","","頼むわ。担当はジミーとアメリアな","","",""
"カヅキ","","ええと、で、ツカサの担当はマーシャ","","",""
"ツカサ","","はい！","","",""
"","","すると、ミチルがマーシャのファイルを見ながら、手を挙げた。","","",""
"ミチル","","カヅキさん、その仕事、私の方が向いてるんじゃ？","","",""
"カヅキ","","そうなんだが、今回はツカサに経験積ませようと思ってな","","",""
"ツカサ","","……？","","",""
"","","どういう意味だろう？\n俺も、改めてマーシャのファイルを見てみた。","","",""
"","","回収対象はマーシャ。\n所有者は若苗ソウタ。８歳。","","",""
"","","若苗ソウタくんには、他に家族は……なし。","","",""
"ツカサ","","…………","","",""
"カヅキ","","問題が起きそうだったらすぐに言え","","",""
"ツカサ","","は、はいっ","","",""
"カヅキ","","以上。なんか連絡事項あるか～？","","",""
"レン","","本社から通達が来てました。最近、闇回収屋の動きが目立ってきてるそうなんで、注意してください","","",""
"","","闇回収屋って、なんだろう？\nはじめて聞いた言葉だ。","","",""
"カヅキ","","うちの名前を騙って、ギフティアを回収してくクズどもか","","",""
"ツカサ","","え、それって犯罪じゃないですか","","",""
"レン","","もちろんそうだよ","","",""
"","","アンドロイドの処分は、そのアンドロイドを製造・販売したメーカーが責任を持って行わなくちゃいけない決まりだ。","","",""
"","","関係ない業者が勝手に連れていっちゃうのは、アンドロイド保護法に違反してる。","","",""
"ミチル","","目的は、なんなんでしょう？","","",""
"シェリー","","ギフティアを解体して、パーツごとに非合法に売りさばくのです","","",""
"コンスタンス","","アンドロイドのパーツは高値で取引されているらしいですから","","",""
"コンスタンス","","我々の頭脳の部分は、特に、ですね。寿命を迎えた後のギフティアでも変わりません","","",""
"","","そんな……。","","",""
"レン","","連中も最近はかなり組織化されていてね、警察も手を焼いてるらしいんだ。もし仕事中に怪しい人間を見かけたら、すぐ報告して","","",""
"タカオ","","あと、できるだけ仕事は効率的にね……","","",""
"","","最後に課長が、申し訳なさそうにそう付け加えて、ミーティングは終わった。","","",""
"ツカサ","","アンドロイドチルドレン？","","",""
"アイラ","","そう。なんらかの都合で実の親と別れて、アンドロイドに育てられた子供のこと","","",""
"","","それが、今回の若苗ソウタくんのケースに当たるのだという。","","",""
"ツカサ","","つまり所有者であるソウタくんは、マーシャが親代わりっていうことか","","",""
"ツカサ","","なにか気を付けることはある？","","",""
"アイラ","","それはケースバイケース","","",""
"ツカサ","","たとえば、今後生活していく施設を一緒に探してあげたりとか、ってわけか","","",""
"","","今日、用意してきた書類の中には、そういう施設のパンフレットも入っていた。カヅキさんが事前に用意してくれていて、俺たちが出かける前に渡してくれたんだ。","","",""
"","","本来は、ターミナルサービスがそこまで面倒を見る必要はないんだけど。","","",""
"","","でも、うちにはうちのやり方がある。\nそういうことですよね、カヅキさん。","","",""
"","","ソウタくんとマーシャの住居は、１４～１５階のマンションがいくつも並ぶ高級団地にあった。","","",""
"","","マーシャが働いているっていうよりは、ソウタくんの両親が残した遺産があって、それを切り崩して生活しているんだろう。","","",""
"","","アンドロイドチルドレンっていうはじめてのケースなだけに、インターホンを押すときには俺もアイラと同じように緊張しちゃったわけだけど。","","",""
"マーシャ","","ようこそ！　ターミナルサービスの人、だよね？","","",""
"ツカサ","","あ……はい","","",""
"","","笑顔で出迎えられて、かなり驚いた。","","",""
"ツカサ","","水柿ツカサです","","",""
"マーシャ","","どうも！","","",""
"","","マーシャは、俺の手を握ると、ぶんぶんと上下に振り回した。","","",""
"ツカサ","","彼女はアイラ","","",""
"マーシャ","","よろしくアイラちゃん！","","",""
"","","挨拶すると同時に、マーシャはいきなりアイラに抱きついた。","","",""
"アイラ","","……！？","","",""
"","","アイラは、突然のことに対応できなくて、目を白黒させていた。","","",""
"","","部屋の中へと俺たちを案内したマーシャは、そのまま台所に入り、てきぱきとお茶の準備を始めた。","","",""
"マーシャ","","適当に座ってて","","",""
"マーシャ","","ソウタなら、もうそろそろ学校から帰ってくると思うから","","",""
"","","部屋には、写真がいくつか飾ってあった。\n４人で写っているものと、２人で写っているもの。\n割合は半々ぐらいかな。","","",""
"","","４人で写っている写真には、マーシャとソウタくん、そしてソウタくんの両親と思われる男女の姿がある。４人とも笑顔だ。","","",""
"","","２人で写っている写真は、当然ながらマーシャとソウタくんの２人だけ。それでも２人とも仲睦まじく笑っている。","","",""
"","","マーシャが台所から出てきてテーブルにお茶を置いてくれたタイミングで、質問してみた。","","",""
"ツカサ","","仲いいんですね","","",""
"マーシャ","","ヘヘ、あの子、ホント甘えん坊で","","",""
"マーシャ","","ずっと２人一緒だったから、私がいなくなったら１人でやっていけるのかなって、ちょっと心配してるんだ","","",""
"ツカサ","","あの写真に写っているのは、ソウタくんのご両親？","","",""
"マーシャ","","うん。３年前に亡くなっちゃったんだけどね","","",""
"ツカサ","","…………","","",""
"マーシャ","","でもでも、すっごく優しい人たちだったんだよ。私にも本当の娘みたいに接してくれたし","","",""
"マーシャ","","たとえば休みの日には、ママと一緒によくお買い物に行ったりしてね","","",""
"マーシャ","","パパとソウタの服を、私とママとで選ぶの","","",""
"マーシャ","","パパがね、服のセンス最悪でさあ！　だから全部ママ任せ。ママはとってもオシャレなの。近所でも評判だったんだから","","",""
"マーシャ","","ま、パパにも素敵なところはいっぱいあったんだけどね。特にスポーツをやらせたらプロ並みにうまくて、ソウタと３人でテニスとかジョギングとか色々やったんだよ","","",""
"マーシャ","","ソウタが途中で音を上げるとね、ママがニコニコしながらケーキを焼いて持ってきてくれるの。これが世界一おいしくて！","","",""
"ソウタ","？？？","またその話？","","",""
"","","マーシャの話に聞き入っていたら、急に玄関の方から声がした。","","",""
"","","見ると、小学生くらいの男の子が靴を脱いで入ってきたところだった。","","",""
"マーシャ","","あ、ソウタ、お帰り！","","",""
"ソウタ","","その人たち、誰？","","",""
"マーシャ","","ターミナルサービスの人。前に話したよね？","","",""
"","","俺とアイラが頭を下げても、ソウタくんはムスッとしたままだった。","","",""
"ソウタ","","マーシャの話、信じない方がいいよ。嘘ばっかりだから","","",""
"ツカサ","","え？","","",""
"","","今の、俺とアイラに向けて言ったの？","","",""
"マーシャ","","ソウタ～？　ツカサくんたち困ってるでしょ","","",""
"ソウタ","","フン","","",""
"","","嘘ばっかりって、どういうことだろう？","","",""
"ツカサ","","ええと、ソウタくん。今日は、君に同意書のサインをもらいに来たんだ","","",""
"ソウタ","","…………","","",""
"","","ソウタくんは、俺が持っているファイルをチラッと一瞥した。","","",""
"ソウタ","","……名前書けばいいの？","","",""
"ツカサ","","え？　ああ、うん","","",""
"ソウタ","","書いたら、すぐに連れてっちゃってよ。もういらないから","","",""
"","","なんだって？","","",""
"ツカサ","","いらないってどういう……","","",""
"ソウタ","","そのまんまだけど。分かんないの？　バカじゃん","","",""
"マーシャ","","こら、お客さんにそういう口の利き方しちゃダメ","","",""
"ソウタ","","マーシャの言うことなんか聞くもんか","","",""
"マーシャ","","あ、そういうこと言うなら、今日はおやつ抜きだからね～","","",""
"ソウタ","","うるさいな。ギフティアのくせに","","",""
"マーシャ","","え……","","",""
"","","ソウタくんはおもむろに俺から書類の入ったファイルを奪い取った。","","",""
"","","中身について確認しようともせずに、回収同意書にサインしようとする。それを見て、俺は慌ててソウタくんを止めた。","","",""
"ツカサ","","ちょっとちょっと、ストップストップ","","",""
"ツカサ","","こんな状態じゃ、サインはもらえないよ","","",""
"","","もともと、ソウタくんでも分かるように書類の内容を説明するつもりでいたけど。さすがにこの状況じゃ、それもできそうにない。","","",""
"ソウタ","","な、なんだよっ。僕はマーシャを連れてけって言ってんのにっ","","",""
"ソウタ","","分かったぞ、お兄ちゃんたちもギフティアなんでしょ？　ギフティアは僕に嘘ばっかりつくんだ","","",""
"ツカサ","","嘘？","","",""
"マーシャ","","ソウタ、なんてこと言うの！　パパがいつも言ってたでしょ。相手を思いやれない人は幸せになれないんだよ","","",""
"ソウタ","","知らないよ！　パパとかママのことなんて、ちっとも覚えてないし！","","",""
"マーシャ","","ソウタ……","","",""
"ソウタ","","パパとママの話だってどうせマーシャの嘘に決まってる！","","",""
"ソウタ","","ずっと一緒にいてくれるっていうのも嘘だったんだから、きっとそうに違いないんだ！","","",""
"","","ソウタくんは、そこまでまくしたてると、家から飛び出していった。","","",""
"マーシャ","","あはは、困っちゃったな……","","",""
"マーシャ","","…………","","",""
"マーシャ","","ソウタは……パパとママが生きていた頃のこと、ほとんど……覚えてないの","","",""
"マーシャ","","だから私、この３年で、その頃の想い出をたくさん、話して聞かせてきたんだけどな","","",""
"マーシャ","","この前、私が寿命のことを話してから、ずっとあんな調子で……","","",""
"アイラ","","…………","","",""
"","","結局、この日は同意書にサインをもらうことなく帰ることになった。","","",""
"","","さてと、困ったなあ。","","",""
"","","これは、思ったよりも複雑な状況みたいだ。","","",""
"ツカサ","","アイラ、どう思う？","","",""
"アイラ","","ミチルに相談してみるべき","","",""
"ツカサ","","え？　ミチル？　なんで？","","",""
"アイラ","","ミチルも、アンドロイドチルドレンなので","","",""
"ツカサ","","……！","","",""
"","","ミチルが、アンドロイドチルドレン……だって？","","",""
"","","さっそく、会社に戻ってミチルに相談してみた。","","",""
"ミチル","","ふぅん。嘘、ね","","",""
"","","ミチルはしみじみとした様子で、俺の話にうなずいた。","","",""
"ミチル","","なんとなく分かる気がする","","",""
"ミチル","","彼は今、自分が何者なのか分からなくなってるんじゃない？","","",""
"ツカサ","","何者なのか……","","",""
"ミチル","","マーシャが悪いわけじゃないんだろうけど","","",""
"ミチル","","そのソウタって子、寿命のことを聞いて、ふと我に返っちゃったのかも。マーシャはギフティアで、本当の家族じゃないって","","",""
"ツカサ","","それで、彼女から聞かされていた実の両親のことまで嘘なんじゃないかって疑うようになった、っていうこと？","","",""
"ミチル","","自分が何者なのか分からなくなるって、かなりの恐怖よ","","",""
"ツカサ","","…………","","",""
"ソウタ","","マーシャの話、信じない方がいいよ。嘘ばっかりだから","","",""
"ツカサ","","なんとかできないかな？","","",""
"ミチル","","大切なのは、自分はちゃんと愛されてたんだって、信じさせることだと思う","","",""
"ツカサ","","信じさせる、か……","","",""
"ミチル","","なんなら、私が手伝ってあげてもいいけど","","",""
"ツカサ","","本当に？　助かるよ。アイラにも伝えておくから","","",""
"ミチル","","あ","","",""
"","","と、ミチルは急にハッとして、お茶汲み中のアイラを見た。","","",""
"ミチル","","や、やっぱり今のなし！　ツカサなんかには手を貸してあげない！","","",""
"ツカサ","","えっ？　なんで？","","",""
"ミチル","","なんでもよ！","","",""
"ツカサ","","ええ～？","","",""
"ザック","","アイラがせっかくツカサと打ち解けてきてるんだから、そこでミチルが出しゃばらない方がいいもんね～","","",""
"ミチル","","なっ、ちょっ、ザック～！","","",""
"","","すごく分かりやすい説明をありがとう、ザック……。","","",""
"","","それと、気を遣ってくれてありがとう、ミチル……。","","",""
"","","翌日。","","",""
"","","ミチルからのアドバイスを受けて、この日も俺とアイラはマーシャの元を訪ねた。","","",""
"","","なんとか、ソウタくんが幼い頃の記憶を取り戻すことはできないかと思ったんだ。","","",""
"","","昼間ということもあって、ソウタくんは学校に行っている。\nこの時間帯がチャンスだ。","","",""
"","","俺たちが真っ先に目を付けたのは、アルバムだ。\nまだご両親が健在だった頃のものも含めて、想い出のアルバムはたくさんある。","","",""
"","","こうした写真の中から、ソウタくんが記憶を取り戻すきっかけとなるようなヒントが見つからないかと思ったんだ。","","",""
"マーシャ","","これで全部だよ～","","",""
"ツカサ","","どうも","","",""
"","","マーシャが、何冊ものアルバムを棚から引っ張り出してきてくれた。","","",""
"","","そのうちの一冊を開いてみる。","","",""
"","","そこには、今より小さいソウタくんと、マーシャ、そしてご両親が笑顔で一緒に写っている写真が並んでいた。","","",""
"マーシャ","","わあ、懐かしいなあ。これ、ソウタの５歳の誕生日だ。明日でちょうど３年かあ……","","",""
"ツカサ","","明日、ソウタくんの誕生日なんですか？","","",""
"マーシャ","","うん、そうなの","","",""
"マーシャ","","あ、これ！","","",""
"","","と、マーシャが、アルバムの中の一枚の写真を指差した。","","",""
"","","それは、ケーキに立てられた５本のロウソクを今にも吹き消そうとしているソウタくんを写したものだった。","","",""
"マーシャ","","イチゴタルト、とってもおいしそうでしょう？　ママの手作りだったんだ～","","",""
"マーシャ","","イチゴタルトを作らせたらママは世界一なの。あんまりおいしかったから、ソウタがほとんどひとりで食べちゃったんだけどね","","",""
"マーシャ","","私もイチゴ並べるの、手伝ったんだよ。真ん中に特別大きいイチゴを乗せると、見栄えがよくなるの","","",""
"ツカサ","","すごい楽しそうですね。……でもソウタくんは、このときのことも覚えてない？　写真だってあるのに？","","",""
"マーシャ","","ん～……やっぱり、ショックだったのかもね。パパとママが亡くなってからしばらくは、あの子ずっと塞ぎ込んでたから","","",""
"マーシャ","","でもだからって、ふたりのことを嘘だなんて思わないでほしいんだ。私はいくら嘘つき呼ばわりされてもいいけど……","","",""
"","","と、アルバムのページをめくった拍子に、間に挟まっていたらしい紙片がひらひらと床に落ちた。","","",""
"","","拾い上げたマーシャが、そこに書いてあるものを見て、目を丸くした。","","",""
"マーシャ","","あ……","","",""
"ツカサ","","なんです？","","",""
"マーシャ","","これ、イチゴタルトのレシピだ","","",""
"マーシャ","","すごい、隠し味とか全部書いてある。ずっと作り方分からなかったんだぁ","","",""
"ツカサ","","…………","","",""
"ミチル","","大切なのは、自分はちゃんと愛されてたんだって、信じさせることだと思う","","",""
"ツカサ","","明日、ソウタくんの誕生日パーティー、するんですよね？","","",""
"マーシャ","","え？　うん","","",""
"ツカサ","","俺たちも参加させてもらっていいですか？　みんなで、このイチゴタルトを作りましょうよ","","",""
"マーシャ","","わあ、それすごくいい！","","",""
"マーシャ","","ごちそうもいっぱい用意しようよ。部屋もかわいくキラキラに飾り付けして。この写真みたいに、みんな笑顔で楽しくお祝いするの！","","",""
"ツカサ","","はい","","",""
"マーシャ","","アイラちゃんも、ちょっと笑ってみて！","","",""
"アイラ","","え……","","",""
"","","いきなりマーシャから話を振られたアイラは、一瞬にしてガチガチになった。","","",""
