"0","受付にいたキレイな女性に対して、俺は直立不動で自己紹介し、頭を下げた。",""
"1","周囲を歩いていた社員の人たちが何事かと怪訝な顔を向けてくる。でも受付の女性は動じることなく、完璧な笑顔で俺を出迎えてくれた。",""
"2","それは、予想外の答えだった。",""
"3","一度外に出て、ビルを仰ぎ見る。",""
"4","そびえ立つのは、地上およそ２５０メートル、５０階建て。\n今日から俺が勤めることになる『ＳＡＩ社』の本社ビルだ。",""
"5","あまりの高さと巨大さに、圧倒されてしまう。",""
"6","元々は、義手や義足を扱う小さなメーカーだったらしいけど、今から２０年前にアンドロイド事業に参入して、急成長を遂げた。",""
"7","こんなすごい企業で働けるなんて、人生、どう転ぶか分からないよね。",""
"8","ほんの数ヶ月前には、大学受験を失敗して失意にくれていたっていうのに。",""
"9","しかも実力で落ちたならともかく、受験当日に虫垂炎になってのリタイアなんて、目も当てられない。",""
"10","父さんはそんな俺に、受験浪人をさせるつもりなんてまったくなくて、ＳＡＩ社で採用面接を受けてこいって、家から俺を放り出した。",""
"11","俺の採用面接をしてくれた伍堂っていう部長さんは、どうやら父さんと旧知の仲だったらしい。",""
"12","ふたりの間で、俺の扱いについてどういう話があったのかは、知るよしもないけど。",""
"13","俺はこの春から、こうして正社員としてＳＡＩ社で働くことになった。",""
"14","自分としては、結果的によかったと思っている。",""
"15","あのままひとりで家にこもっていたら、いつまでも受験失敗を引きずって腐っていただろうから。",""
"16","気持ちの切り替えはできた。正社員として働くからには、精一杯頑張ろう。それが、父さんの恩に報いることでもある。",""
"17","俺は、ネクタイを締め直すと、受付の女性が言っていた“裏”へと回ってみることにした。",""
"18","そこに、俺が働く部署である『ターミナルサービス』があるんだ。",""
"19","もしかして途中で道を間違えただろうかと思ったけど、近くには他にそれらしい建物はない。",""
"20","恐る恐る、オフィスビルの玄関に近寄ってみると、小さく表札があった。",""
"21","『ＳＡＩ社　第１ターミナルサービス』",""
"22","なかなか、本社ビルとのギャップがすごいけど。",""
"23","それに、あんまり人の気配がしないけど。",""
"24","って、まずい！　もう出社時間ギリギリだ！\n初日から遅刻なんて、社会人失格だ！",""
"25","緊張しつつ２階にあがると、社員の人がいるオフィスがあった。",""
"26","入るなり、頭を下げて元気よく挨拶。",""
"27","あれ？",""
"28","反応がない。",""
"29","直立不動のまま、オフィス内を見回した。",""
"30","部屋の中には、７人の社員がいた。",""
"31","全員、ポカーンとして俺のことを見ている。",""
"32","お、おかしいな……。場所を、間違えたのかな？",""
"33","っていうか、社員の中にひとり、中学生ぐらいの金髪の男の子がいるんだけど……。なんで子供がここに？",""
"34","と、カヅキさんが寄ってきて、しげしげと俺の顔を見つめてきた。",""
"35","人前でそれを言われても、どんな顔をしていいのやら……。\n結局は、コネ入社っていうことになるわけで。",""
"36","え、事前に伝わってなかったんだ……。\nっていうか、“組ませる”ってどういう意味だろう？",""
"37","実のところ、伍堂部長のところへ採用面接に行ったのは２ヶ月ぐらい前だけど、ターミナルサービスという部署で働くのだと知らされたのは、ほんの数日前だったりする。",""
"38","しかも、ＳＡＩ社のサイトを調べてみても、ターミナルサービスについては説明がどこにも載っていなかったんだ。",""
"39","それが、ＳＡＩ社が開発、製造、販売を行っているアンドロイドの商品名だ。",""
"40","そ、そうなのか……。",""
"41","人とまったく見分けが付かない。",""
"42","もうひとり、俺と同年代ぐらいの女の子がいるけど、目が合うとプイと顔をそらしてしまった。彼女は……どっちだろう？",""
"43","まさか、入社初日にクビ！？",""
"44","最悪の事態を想像して、ゾッとした。",""
"45","なんとかここで働かせてもらわないと。",""
"46","でもどうしたら……。",""
"47","そのとき、オフィスのドアが開き、誰かが入ってきた。",""
"48","何気なくその人物へと目を向けて、ハッとした。",""
"49","この子は……！",""
"50","アイラ……。",""
"51","アイラっていう名前なのか。",""
"52","と、思ったんだけど。",""
"53","アイラの方は、一度も目を合わせようとせず、素っ気ない。",""
"54","俺のことなんて完全無視で、持ってきたティーセットでお茶の用意を始めた。",""
"55","もしかして、人違い……？",""
"56","いやいやいや！",""
"57","忘れるわけがない。",""
"58","あのとき、ライトアップされた遊園地の観覧車を眺めながら、ひとり静かに涙を流していた女の子の顔を、見間違えたりなんかするもんか。",""
"59","この子も、この第１ターミナルサービスで働く社員なのかな？\nどう見ても中学生ぐらいだけど。",""
"60","それって、つまり……？",""
"61","山野辺課長が突然そう言い出し、俺とアイラ以外の全員に動揺が走った。",""
"62","カヅキさんに至っては、課長の襟首をつかんで、締め上げかねない勢いだ。",""
"63","コンスタンスが優しく止めに入ったおかげで、カヅキさんは渋々、課長から手を離した。",""
"64","彼女の声を、そのとき俺は、はじめて聞いた。",""
"65","勤務開始からたった３０分で色々なことが起こりすぎて、正直なところ、頭の整理が追いついていなかった。",""
"66","俺はいまだにフワフワした気持ちのまま、取り急ぎ支給されたターミナルサービスの制服に着替えた。",""
"67","それにしてもカヅキさんをはじめとしてみんなが、あの子――アイラのことを腫れ物に触るみたいに扱っていたけど。なにかあるのかな？",""
"68","ロッカールームからオフィスに戻ろうとしたら、廊下でアイラが待っていた。",""
"69","待ってて……くれたんだよね？",""
"70","っていうか、さっきのカヅキさんの説明が本当なら、俺と組むことになったこの子は、ギフティアっていうことになる。",""
"71","ギフティア、か……。",""
"72","アイラが機械なんだって言われても、まったく実感がわかない。",""
"73","だから、どう接すればいいか、いまいちよく分からない。",""
"74","……いや。難しいことは考えないでおこう。",""
"75","だって、俺と彼女は。",""
"76","手を、差し出したら。",""
"77","アイラは、やっぱり無表情のままだったけど、握手はしてくれた。",""
"78","柔らかくて、あったかい手だった。",""
"79","あれ？",""
"80","あのとき会った子と、同一人物、だよね？\nやっぱり人違いだった、なんてことは、ないよね？",""
"81","と、いつの間にか現れたザックが、握手したままの俺とアイラの間に割って入ってきた。",""
"82","慌ててアイラから手を離す。",""
"83","ニヤニヤしているザックの後ろから、さっき一言も言葉を交わさなかった女の子がやって来た。",""
"84","いきなり怒られた。",""
"85","それだけ言うと、ミチルとザックはさっさと階段を降りていってしまった。",""
"86","俺、着替えたばかりで自分の席もまだ教えてもらってないんだけど……。",""
"87","俺より年下なのか。\nそんな若くしてＳＡＩ社の社員なんて、すごいな。",""
"88","このふたり、仲いいなあ。",""
"89","ミチルって、カリカリしているように見えるけど、根はいい人みたいだ。",""
"90","ただ、まだちょっと怖い……かな。",""
"91","俺の隣に座るアイラは、この賑やかなやり取りの間も、正面を見つめたまま黙り込んでいた。",""
"92","パートナーと交わした会話らしい会話は、今のところほぼ皆無。\nこれはよくないぞ。",""
"93","なにも反論できない。",""
"94","アイラは懐から、手帳のようなものを取り出して、俺に渡してきた。",""
"95","すごく不穏な言葉を聞かされて少し鼻白みながら、俺は受け取った手帳の最初のページを開いた。",""
"96","って、これ、ただの日記だし！",""
"97","アイラに手帳を返そうとしたら、その前に車が停まった。",""
"98","車を降りてミチルに尋ねると、ファイルを渡された。",""
"99","今どき珍しい、紙のファイルだ。",""
"100","回収対象であるギフティアの情報が、顔写真付きで載っている。",""
"101","ミチルが俺たちに説明をしている間に、ザックが呼び鈴を押した。",""
"102","いったい、どんなものなんだろう？",""
"103","呼び鈴に応えて、岩井夫婦が出てきた。\n人の好さそうな初老の夫婦だ。",""
"104","うっわ。",""
"105","すごい変わり様だ。",""
"106","強化の意味ってこういうこと？",""
"107","アイラも仕事モードに入ると、あんな風に愛想がよくなるのかな？",""
"108","岩井夫妻とエドワードは、回収に来たザックを友人として出迎えてくれた。",""
"109","信頼関係が築けている……。そう感じた。",""
"110","ミチルの方は、乗ってきた車の運転席に座ってなにやら操作を始めた。",""
"111","と、車の後部に据え付けられている、まるで棺桶みたいなポッドが立ち上がり、カバーが開いた。座席のようなものが展開して、ちょうど人がひとり座れるようになる。",""
"112","なるほど。\nどうやら、回収したギフティアはそこに収容するみたいだ。",""
"113","ザックがエドワードの手を引いて、展開したハイバネートボックスの前まで導く。",""
"114","エドワードはすべて分かっているみたいで、黙ってそこへ腰を下ろした。",""
"115","岩井夫婦がエドワードに寄り添い、最期の別れの挨拶をする。",""
"116","それまでなんとか笑顔を浮かべていたけど、ついに感極まって、３人は涙ながらに肩を抱き合った。",""
"117","運転席から戻ってきたミチルが俺の横に立ち、小声で説明してくれる。",""
"118","ザックがエドワードの右手の中指に、指輪をはめた。\nザックの右手にもすでに指輪がはめられている。",""
"119","ふたつ一組ということは、ザックがはめている指輪も、エドワードのものっていうことか。",""
"120","ザックとエドワードは、指輪をはめた右手同士をそっと合わせた。",""
"121","するとエドワードの身体が淡い光に包まれ、首にチョーカーのようなものが浮かび上がった。",""
"122","光が消えると同時に彼は意識を失い、顔のすぐ目の前に小さなホログラフィックモニタが投影された。",""
"123","『完全消去プログラムを完了しますか？』",""
"124","神妙な面持ちでザックがそのモニタのアイコンをタッチして消し、力を失ったエドワードの身体をボックスの背もたれにもたせかける。",""
"125","ミチルがまた運転席から操作を行って、ボックスを収納する。",""
"126","最後に、目に涙を浮かべて見守っていた岩井夫妻に回収完了のサインをもらった。",""
"127","回収したギフティアは、本社まで運んで来て、最終処分を担当するスタッフへとハイバネートボックスごと引き渡す。",""
"128","所有者には、回収したギフティアをどうするのか、事前に３つの選択肢を提示するんだという。",""
"129","ひとつは、同じ機体に新しいＯＳ――つまり新しい人格だ――を入れ直して継続利用する。当たり前だけど、前のＯＳの記憶は存在しない。",""
"130","もうひとつは、下取りに出して新しいギフティアを格安で購入する。",""
"131","３つ目として、ギフティアの購入時の金額の３割をキャッシュバックする。",""
"132","所有者が、１つ目のＯＳ入れ替え以外の選択をした場合、回収されたギフティアは……ボディごと処分されてしまう。",""
"133","いったいそれがどんな形で行われるのかは……あまり考えたくなかった。",""
"134","俺の質問に、ミチルが表情を陰らせたように見えた。",""
"135","もしかして、まずいこと聞いたかな？",""
"136","代わりにアイラが答えてくれた。",""
"137","確かにそんな状態になったら、一緒に過ごしてきた所有者の人たちも辛いだろう。",""
"138","今日のエドワードの回収は、家を訪ねてからかかった時間はほんの３０分くらいだった。移動時間の方が長かったぐらいだ。",""
"139","横にいたアイラに恐る恐る聞いてみたら、無表情のままこくりとうなずかれた。",""
"140","次の日。",""
"141","今日もミチルとザックに付いて回ってるんだけど。",""
"142","ミチルの、言う通りだった……。",""
"143","所有者に挨拶したミチルが、見事なまでの門前払いを食らって、笑顔のまま固まってしまっている。",""
"144","想い出を引き裂く仕事。",""
"145","アイラが言ったその言葉がふと脳裏によみがえった。",""
"146","ターミナルサービスって、もしかして“お客さんから嫌われる仕事”なのかもしれない。",""
"147","俺は、今回の回収対象と所有者について書かれたファイルを確認した。",""
"148","おおっ！",""
"149","これなら、俺が足を引っ張りさえしなければ、大丈夫そうだ。",""
"150","やってきたのは、古びたマンションの一室だった。",""
"151","ここに住む回収対象はミモザ。所有者は木賊コウヘイ。",""
"152","ミチルからの説明が終わったのと同じタイミングで、６０５号室のドアの前に辿り着いた。",""
"153","アイラが、一歩踏み出す。",""
"154","そのままドアの横にあるインターフォンのボタンへと手を伸ばし。",""
"155","アイラが、止まった。\nボタンを、押そうとしない。",""
"156","なんだか不安になってきたので、アイラの横まで行って呼びかけてみた。",""
"157","なぜか涙目になってプルプル震えている。",""
"158","俺は、アイラに言われるままに呼び鈴を鳴らした。",""
"159","反応がない。",""
"160","ドア越しに呼びかけてみると。",""
"161","部屋の中から、なんだかやけに騒々しい物音が聞こえてきた。",""
"162","でも、物音はすぐに途絶え、今度はシンと静まり返る。",""
"163","家主が出てくる気配はない。",""
"164","アイラは焦った様子で周囲をキョロキョロ見回すと、廊下の手すりから身を乗り出し、下の階を指差した。",""
"165","俺とミチルも同じように眼下をのぞき込むと、木賊コウヘイさんとミモザが、ベランダ越しに隣のマンションに飛び移り、逃げようとしているところだった。",""
"166","アイラはうなずくと、１１階の廊下の手すりへと足をかけた。",""
"167","まさか、飛ぶ気！？",""
"168","ドキッとした。\nここからだと、隣のマンションまではけっこうな距離がある。\nもし落ちたりしたら、ケガだけじゃすまない。",""
"169","でも、アイラはなんの躊躇もしなかった。",""
"170","そのまま手すりを蹴るようにして空中へ躍り出て――",""
"171","まったく飛距離が足りずに、そのまま下へと垂直に落ちていった。",""
"172","手を伸ばしたけど、間に合うはずはなかった。",""
"173","そう説明してくれたのは、第１ターミナルサービス専属のエンジニアである、鉄黒ミキジロウさんだった。",""
"174","ミキジロウさん、雰囲気あるなあ……。",""
"175","でも、ギフティアが頑丈でよかった。",""
"176","っていうか、さっきからアイラの身体からずっと生ゴミの匂いがぷ～んと漂ってくるわけだけど。服も髪も汚れたままだし。",""
"177","アイラは小さくうなずいた。",""
"178","ひとりで先にオフィスに戻ると、ミチルとザックが課長のデスクの前に立って、今日のことを報告しているところだった。",""
"179","急いで俺もそこに加わる。",""
"180","そう、アイラが１１階から落ちた後、木賊コウヘイさんとミモザについては、外で待機していたザックがあっさりと捕まえてしまっていた。",""
"181","木賊さんが取った行動――ギフティアを連れて逃げようとしたこと――は、最悪の場合、法律違反でＳＡＩ社から賠償請求もできるのだときつく厳重注意をして、解放したけど。",""
"182","そこへカヅキさんが肩を怒らせながらオフィスに入ってきた。",""
"183","いきなり首根っこを掴まれ、廊下へと引っ張り出された。",""
"184","そのまま壁に押し付けられ、凄まれる。",""
"185","自分の机に戻ると、自然とため息が出た。",""
"186","殴られるかと思った。カヅキさんがあんなに怖い人だったなんて。",""
"187","隣の席のミチルが、俺の様子を見て声をかけてくる。\n課長への報告はもう終わったらしい。",""
