"","","でもマーシャは構わずアイラの頬を両手でムニッと挟み込むと、笑顔にさせようとする。","","",""
"マーシャ","","ほら、に～って","","",""
"アイラ","","……っ","","",""
"","","笑顔っていうより、変顔……かな。\n少なくとも、笑っているようには見えない。","","",""
"マーシャ","","せっかくかわいいんだから、笑った方がいいって！","","",""
"アイラ","","にー……","","",""
"","","と、マーシャの手から解放されたアイラは、今度は自分で手を使って、無理矢理笑顔を作った。","","",""
"","","……や、やっぱり、ヘンテコ顔、だなあ。","","",""
"","","幼い子供に見せたら、泣かれるかもしれない。","","",""
"","","俺と話しているときは、たまに微笑んだりしてくれるのに。","","",""
"","","笑顔を作れって言われると、逆に意識して、できなくなっちゃうのかもしれないな……。","","",""
"","","いずれにせよ、ソウタくんに対してどう対応するのか、その方針は決まった。","","",""
"","","朝早くに、ソウタくんの住む団地の前で待機する。","","",""
"","","食材は昨日のうちにそろえた。","","",""
"","","後は、ソウタくんが学校に行くのを見計らって、準備開始だ。","","",""
"アイラ","","…………","","",""
"アイラ","","ツカサ","","",""
"アイラ","","これは、ソウタにとって本当に幸せなことなの？","","",""
"ツカサ","","え？　それってどういう……","","",""
"アイラ","","…………","","",""
"アイラ","","……ううん。なんでもない。忘れて","","",""
"ツカサ","","でも……","","",""
"アイラ","","役割分担、なので。私は、ツカサの判断に従う","","",""
"ツカサ","","……？","","",""
"","","と、ちょうどそのとき、ソウタくんが団地から出てきた。\n階上からマーシャが手を振って見送ってるけど、ソウタくんはそれをチラリと見上げただけで、なんの反応もしようとしない。","","",""
"","","アイラがなにを言おうとしたのか、少し気になったけど。\nあんまり時間はない。","","",""
"ツカサ","","じゃあ作戦開始だ","","",""
"","","俺とマーシャで、まず真っ先にイチゴタルトを作ることにする。","","",""
"マーシャ","","私は隠し味担当。ツカサくんは生地担当。オッケー？","","",""
"ツカサ","","任せてください","","",""
"マーシャ","","他にもソウタの好きなごちそうをたっくさん用意しなきゃ！　忙しくなるぞー！","","",""
"","","そっちの食材は、マーシャがたっぷり買い込んだらしい。","","",""
"マーシャ","","ところでツカサくんって、料理はどれぐらいできるの？","","",""
"ツカサ","","この前、フランベっていうのをやりました。焦がしちゃいましたけど","","",""
"マーシャ","","た、頼りにしてるよ～","","",""
"マーシャ","","ん？　誰かな。ちょっと見てくるね","","",""
"ツカサ","","まさか、ソウタくんが戻ってきたとか？","","",""
"マーシャ","","あはは。まさか～","","",""
"","","マーシャは、来客の対応のために玄関へと向かった。","","",""
"","","こっちは作業を進めよう。","","",""
"ツカサ","","ええと、タルトの生地に必要なのは、薄力粉と、小麦粉と、砂糖、卵黄……","","",""
"アイラ","","ツカサ、大丈夫？","","",""
"ツカサ","","もちろん！","","",""
"ツカサ","","レシピはあるんだ。それをきちんと守れば、下ごしらえの時点でミスなんてしないって","","",""
"","","するとアイラは、見やすいようにわざわざレシピを手で持って、俺の横に控えてくれた。","","",""
"","","レシピ通りに完璧に。","","",""
"","","ソウタくんが知っているイチゴタルトを正確に再現しないと、今回は意味がない。","","",""
"","","慎重に慎重を重ねて、作っていくぞ。","","",""
"ツカサ","","ええと、バターを５０グラム……","","",""
"","","計量器にキッチンペーパーを敷き、少しずつバターを乗せていく。","","",""
"","","３５グラム……４１グラム……４４グラム……４６グラム……４９グラム……５０グラム。","","",""
"","","ふう、これでよし。","","",""
"ミチル","","あんたねえ、そんないちいち細かく測ってたら、日が暮れちゃうでしょ","","",""
"ツカサ","","え？　ミチル、それにザックも","","",""
"","","来客って、この二人だったのか。","","",""
"ツカサ","","どうして……","","",""
"ミチル","","手伝いに来てやったのよ","","",""
"ザック","","ミチルがさあ、ソウタくんのこと、やっぱりほっとけないんだって～","","",""
"ツカサ","","でもこの前は、手伝わないって……","","",""
"ミチル","","気が変わったの！","","",""
"","","そ、そうなんだ……。","","",""
"ミチル","","マーシャさん。私も協力するわ","","",""
"マーシャ","","助かる～。正直、ツカサくんってあんまり戦力にならなさそうだったから。よろしくねっ","","",""
"","","うっ、マーシャ、間違ってはいないけど、そうはっきり言われるとけっこうショックだよ……。","","",""
"ミチル","","ツカサ、ほら、貸して！","","",""
"","","と、ミチルは俺を押しのけると、手際よくボウルに素材を入れ、かき混ぜ始めた。","","",""
"","","すごく手慣れている。\nこれは、まるでプロの料理人の手つきだ。","","",""
"マーシャ","","わあ、やるね～！","","",""
"ツカサ","","もしかして料理得意なの？","","",""
"ミチル","","子供の頃からやってたから。父さんの分も私が作ってた","","",""
"ツカサ","","へえ……","","",""
"ミチル","","ボーッとしてないで、ツカサは薄力粉を用意して","","",""
"ミチル","","アイラ！　ザック！　あんたたちはイチゴのヘタ取り！","","",""
"","","ミチルが加わったことで、一気にキッチンが緊張感に包まれた。","","",""
"","","アイラとザックは、イチゴのパックをマーシャから受け取ると、リビングで作業を始めた。","","",""
"","","一方の俺も、ミチルに言われるまま、薄力粉を持ってスタンバイする。","","",""
"ミチル","","じゃ、ふるいながら入れて","","",""
"ツカサ","","よし！","","",""
"","","言われた通りにやってみる。","","",""
"ツカサ","","あ、あれ？　まずいっ","","",""
"","","強く振りすぎたせいで、薄力粉が舞い上がってきた……！","","",""
"ツカサ","","ふぇっくしょ！","","",""
"ミチル","","ひゃっ！","","",""
"","","たまらずくしゃみをしたら、さらに粉が舞って、ミチルの顔を白く染めた。","","",""
"ツカサ","","ごめん！","","",""
"ミチル","","これだから素人は……！","","",""
"ミチル","","強く振りすぎなのよ","","",""
"","","ミチルは顔を拭いつつ俺からふるいを奪い取ると、軽く振って見せてくれた。","","",""
"ミチル","","これぐらいでいいの。分かる？","","",""
"ツカサ","","なるほど","","",""
"","","レシピやマニュアルだけでなんとかなると思っていたけど。\n経験に裏打ちされたやり方だけに、効率が全然違う。","","",""
"","","これなら、なんとかなりそうだ。","","",""
"","","イチゴを乗せる前のタルトを、慎重にオーブンに入れ、タイマーをセットする。","","",""
"","","そこでマーシャが一息ついた。\n俺とミチルの肩をポンポンと嬉しそうに叩いてくる。","","",""
"マーシャ","","焼き上がるまでだいたい３０分くらいかかるから、それまで休憩しよ","","",""
"","","アイラとザックは、イチゴのヘタ取りを終えて、今は部屋の飾り付けをしている。マーシャはそっちの様子を見に行った。","","",""
"ツカサ","","ミチルが手伝いに来てくれて助かったよ","","",""
"ミチル","","別に、あんたのためじゃないから。同じアンドロイドチルドレンとして、ほっとけなかったの","","",""
"ミチル","","あの子……ソウタくんは、意地を張り続けるだけ。それが辛いことだって、自分で分かってるのにね","","",""
"ツカサ","","…………","","",""
"ツカサ","","あのさ、ソウタくんの気持ちが分かる気がするって、前に言ってたよね？　それってつまり……","","",""
"ミチル","","ええ、私の父さん……じゃなくて、保護者って言った方がいいのかな？　３年前に、回収されたわ","","",""
"ツカサ","","…………","","",""
"","","そういうことだったのか……。","","",""
"ミチル","","ただ、私の場合はソウタくんとは逆だった","","",""
"ミチル","","父さん１人にずっと育てられてきたこともあってね、必死に、繋ぎ止めようとしちゃったの","","",""
"ミチル","","そのせいで、父さんはワンダラーに……","","",""
"","","ワンダラー？\n前にもアイラから聞いた言葉だ。","","",""
"","","……踏み込んでも、いいのかな？","","",""
"ツカサ","","どういうこと？","","",""
"ミチル","","……ギフティアはね、８１９２０時間を過ぎると、人格や記憶が徐々に消えていくの","","",""
"ミチル","","だいたい１０時間もすると、もう本能的な行動しかできなくなっちゃう","","",""
"ミチル","","意志も人格もなくて、でも運動能力は残ってるからあっちこっち歩き回る。それで、ワンダラー","","",""
"ミチル","","ワンダラーになったケースでも、およそ９割は、特に抵抗もなく捕まえられるの。居場所を把握するのは大変だけどね","","",""
"ツカサ","","残りの１割は？","","",""
"ミチル","","滅多にないケースだけど。……人を……襲う場合もある","","",""
"","","なんだって……？","","",""
"ミチル","","とにかく、回収対象をワンダラーにしてしまうのは最悪なケースよ。私たちは、そうなる前にきっちり回収しなきゃいけないの","","",""
"ツカサ","","もし、回収できなかった場合は？","","",""
"","","それは、はじめての仕事のときにもした質問だった。","","",""
"","","そして、それに対する答えも、一緒だった。","","",""
"ミチル","","回収するの。なんとしても","","",""
"ミチル","","でないと……みんな、辛い思いをする","","",""
"","","その“辛い思い”っていう言葉の中に、どれほどの過去が込められているんだろう。","","",""
"ツカサ","","ミチル……","","",""
"","","想像したら、なにも……言えなくなってしまった。","","",""
"ミチル","","って、な、なんであんたがそんな顔してんのよっ","","",""
"ツカサ","","ありがとう、俺なんかに話してくれて","","",""
"ミチル","","…………","","",""
"ミチル","","なんか、とか言うんじゃないわよ。あんたはもう、ターミナルサービスの人間なのよ","","",""
"ミチル","","同情してほしくて話したわけじゃない","","",""
"ミチル","","過去の事例を知って、学習して、次に活かすの","","",""
"ツカサ","","うん。そうするよ","","",""
"ミチル","","……分かれば、いいけど","","",""
"","","少し困ったような顔でそう言ったミチルは、休憩を終わらせて、別の料理の作業に取りかかり始めた。","","",""
"ツカサ","","ごめん、俺知らなくて……","","",""
"ミチル","","ああもう、あんたにこんな話するんじゃなかった！　完全にミスった！　今すぐ忘れなさい！","","",""
"ツカサ","","そんな無茶な","","",""
"ミチル","","いいから。この話は終わり！","","",""
"","","ミチルは、さっさと休憩を終わらせると、別の料理の作業に取りかかり始めた。","","",""
"","","その後も、誕生日パーティーの準備は進んだ。","","",""
"","","今回のパーティーで一番重要なイチゴタルトは、マーシャにイチゴの盛り付けを任せた。真ん中には、あの写真と同じように特別大きなイチゴを乗せた。","","",""
"","","そして気が付けば、ソウタくんが学校から帰ってくる時間が迫っていた。","","",""
"","","部屋の明かりを消して。カーテンも閉め切って。","","",""
"","","主賓が帰ってくるのを待つ。","","",""
"","","これが空振りにならないでほしいって願った。","","",""
"","","所有者とギフティアが、ギクシャクした仲のままその関係を終えるなんて、そんなの、悲しすぎるから。","","",""
"","","と、玄関の方でドアが開く音がした。","","",""
"ソウタ","","ただいま","","",""
"ザック","","来た！","","",""
"","","俺たちはクラッカーを準備して、息を殺しつつソウタくんがリビングに入ってくるのを待ち構えた。","","",""
"ツカサ","","今だ！","","",""
"ツカサ","一同","お誕生日おめでとう！","","",""
"ソウタ","","…………！","","",""
"","","びっくりしたのか、ソウタくんは固まってしまっている。","","",""
"マーシャ","","待ってたんだよ～。さ、座って","","",""
"","","マーシャがそんなソウタくんの背中を押して、席に座らせた。","","",""
"","","テーブルには、俺たちが用意したごちそうの数々。そして想い出のイチゴタルト。","","",""
"","","ただ、ソウタくんは席についた途端、状況を理解したのか明らかにムスッと頬を膨らませた。","","",""
"ソウタ","","僕、別に祝ってほしいなんてお願いしてないけど","","",""
"マーシャ","","もう、ソウタったら照れちゃって。ホントは嬉しいくせに","","",""
"ソウタ","","こんなことしないでって言ってるんだよ！","","",""
"マーシャ","","……！","","",""
"","","ソウタくんの剣幕に、俺たちは言葉を失った。","","",""
"","","このやり方は、間違っていたの？","","",""
"ソウタ","","こんなことされたって、どうせみんな僕を置いてどっか行っちゃうんだ。こんな嘘ばっかりのお祝いなんて、いらないよ――","","",""
"","","まくしたてていたソウタくんが、そこでハッと息を飲んで絶句した。","","",""
"","","その幼い瞳が、テーブルの上に置かれているたくさんの料理の中で、まっすぐにイチゴタルトへと向けられている。","","",""
"ソウタ","","これ……","","",""
"マーシャ","","ママのイチゴタルトだよ","","",""
"","","マーシャはすぐに、タルトを切り分けてソウタくんの前に差し出した。","","",""
"ソウタ","","…………","","",""
"","","ソウタくんは、なおも黙っていた。","","",""
"","","食べたいとも、いらないとも、言わなかった。","","",""
"","","でも、黙ったまま、フォークを手に取ると、タルトをゆっくりと口に運んだ。","","",""
"","","何度か咀嚼して、ごくんと飲み込むと、もう一口。さらにもう一口。","","",""
"","","俺たちはみんな、固唾を飲んで見守った。","","",""
"ソウタ","","う……うぅ……","","",""
"","","食べながら、ソウタくんは、いつの間にか涙をこぼしていた。","","",""
"ソウタ","","こんなの、ちっともおいしくないよ","","",""
"マーシャ","","ソウタ……","","",""
"ソウタ","","ママが作ったやつの方が、ずっとずっと、おいしかったんだから","","",""
"マーシャ","","……うん","","",""
"ツカサ","","あっ……","","",""
"","","今、“ママが作ったやつ”って……！\nもしかして、思い出してくれた！？","","",""
"","","ミチルに目だけで尋ねてみると、同じことを考えていたみたいで、うなずきを返してくれた。","","",""
"","","やった……。","","",""
"ソウタ","","マーシャ、ごめんね。嘘つきだなんて言って","","",""
"マーシャ","","……私はいなくなっちゃうけど、これからもずっとずっと一緒だからね","","",""
"ソウタ","","またそうやって、適当なこと言うんだ","","",""
"マーシャ","","でもね、これは嘘じゃないよ。ホントのホントの気持ち。私はこれからもずっとソウタのこと見守ってるから","","",""
"マーシャ","","私だけじゃないよ！","","",""
"ソウタ","","パパやママも一緒だって、言うんでしょ？","","",""
"マーシャ","","うん！　そう！","","",""
"ソウタ","","……ありがと、マーシャ","","",""
"ソウタ","","うぅ……うわああん！","","",""
"","","ソウタくんは、ずっと我慢していたのか、泣きながらマーシャの胸に飛び込んだ。","","",""
"","","マーシャは弟をあやすみたいに、ソウタくんの頭を優しく撫でる。","","",""
"","","そんなふたりを見て、俺はホッと息をついた。","","",""
"","","会社に戻ってから。","","",""
"","","今日のことを報告書に書いていたら、一緒に残ってくれたアイラが、ハーブティーを出してくれた。","","",""
"","","お礼を言って一口飲んでから、俺はアイラに向き直った。","","",""
"ツカサ","","今朝、言ったよね。これはソウタくんにとって本当に幸せなことなのかって？","","",""
"アイラ","","……うん","","",""
"ツカサ","","今回のことがソウタくんにとって幸せなのかどうかは、俺には分からない","","",""
"","","いずれにしても、あと１週間くらいで、別れは来ちゃうんだ。\nそうなれば、ソウタくんは天涯孤独、ひとりぼっちになる。","","",""
"ツカサ","","それでも、少なくともマーシャとは仲直りできただろう？","","",""
"ツカサ","","それって、悪い想い出のままで終わっちゃうより、ずっといいと思わない？","","",""
"アイラ","","…………","","",""
"","","アイラは、かすかに微笑んだだけで、なにも答えてくれなかった。","","",""
