"","","ダメだ、この人……。","","",""
"","","っていうか、オリヴィアじゃなくなっていることを、エルさんは気にしてないのかな。……気に、ならないものなんだろうか。","","",""
"","","みんな、そんなものなのかな？","","",""
"アイラ","","…………","","",""
"","","数日後。","","",""
"","","レンさんが、たった今、宅急便で届いた荷物の中身を見て、顔を綻ばせた。","","",""
"レン","","この前のアンディの件で、第３ターミナルサービスの課長からお礼が届いてますよ。お茶菓子です","","",""
"タカオ","","いいねぇ。アイラちゃん、お茶よろしく～","","",""
"","","アイラはうなずき、給湯室に行ってすぐにお茶の用意を始めた。","","",""
"タカオ","","いやあ、このあいだ来たアンディくんは実に手際よかったよねえ。パパッと仕事してサーッと帰っていっちゃった感じで","","",""
"ミチル","","うわ、それ、私たちが使えないってことですか？","","",""
"タカオ","","い、いやいや、そういう意味じゃないよぉ","","",""
"ミチル","","どうだか……","","",""
"","","まあ、効率だけを考えるなら、うちは相当、悪いよね……。","","",""
"","","そもそも回収対象の元を事前に何度も訪ねるなんてことは、他のターミナルサービスじゃ滅多にないことらしいし。これもヤスタカさんから教えてもらった情報だ。","","",""
"","","このやり方は、効率もそうだけど、回収する側である俺たちの方にかなりの負担になる。","","",""
"","","それでもやっぱり、俺はアンディみたいな強引なやり方は、できそうにないよ。","","",""
"エル","","ツカサっちー！","","",""
"","","と、エルさんがオフィスに勢いよく駆け込んできた。","","",""
"","","なぜか泣きそうな顔をして、俺にすがるような目を向けてきた。","","",""
"エル","","助けてください～！","","",""
"ツカサ","","……へ？","","",""
"","","とりあえずオフィス内だと迷惑になりそうだったから、ロビーに出てエルさんを落ち着かせてから、話を聞くことにした。","","",""
"エル","","私の地元って、この時期にけっこう大きなカーニバルが開かれるんですよ","","",""
"エル","","あ、気取ってカーニバルなんて言ってますけど、別に仮装パレードとかしませんよ？　単に、ちょっと気が早い夏祭りです","","",""
"エル","","そのことをアンディに話したら、ぜひ連れてってくれとせがまれまして","","",""
"ツカサ","","はあ","","",""
"エル","","それが今夜なんですよ！　というわけでツカサっち！　一緒に来てくださいぃ！","","",""
"ツカサ","","な、なんで俺が？　２人で楽しんでくればいいじゃないですか","","",""
"エル","","ムリムリムリ！","","",""
"ツカサ","","どうして？","","",""
"エル","","…………","","",""
"エル","","オリヴィアとの想い出だらけなんですよ……。そこに、アンディと２人きりで行くなんて……キツすぎるでしょ。同じ顔、してるんですから……","","",""
"ツカサ","","エルさん……","","",""
"エル","","だからツカサっち～、一緒に来てぇ！　私を助けると思ってぇ！　お願いしますよぉ！","","",""
"ツカサ","","し、しがみつかないでぇ！","","",""
"","","無理矢理、エルさんの身体を引き剥がし、自販機で買ったジュースを渡してもう一度、落ち着かせる。","","",""
"ツカサ","","…………","","",""
"","","どう答えるか考えているうちに、ふと、ここ最近ずっと頭の中でモヤモヤしていたものがまた浮かび上がってきた。","","",""
"ツカサ","","あの、たとえばですけど","","",""
"ツカサ","","アンディをカーニバルに連れていったら、それをきっかけにしてオリヴィアの記憶がちょっとでもよみがえったり……なんてこと、あると思いますか？","","",""
"エル","","ふうん……","","",""
"エル","","アイラっちのこと、考えてるんですね","","",""
"ツカサ","","えっ、あの、それは……","","",""
"エル","","これでもエンジニアですよ。私も、アイラっちの残り時間については知ってます","","",""
"ツカサ","","……どうなんです？","","",""
"エル","","…………","","",""
"エル","","私がなに言ったって、そう簡単には納得できないでしょ？","","",""
"エル","","だからいいですよ、ツカサっちも私を利用してくれて","","",""
"ツカサ","","利用、って……","","",""
"エル","","一緒に行きましょう、今夜。そこで、自分の目で確かめればいい","","",""
"ツカサ","","…………","","",""
"","","エルさんの言う通りだ。","","",""
"","","もしも……可能性が、ほんの０．１％でもあるのなら……。それを、この目で、確かめてみたかった。","","",""
"","","というわけで、今夜、カーニバルに行くことをアイラに話してみた。","","",""
"アイラ","","私も行く","","",""
"アイラ","","わ、私は、ツカサのパートナーなので","","",""
"","","その申し出は意外だった。","","",""
"ツカサ","","ちなみに、アンディも一緒だけど","","",""
"アイラ","","…………","","",""
"アイラ","","……行く","","",""
"ツカサ","","あと、エルさんももれなく付いてくるけど","","",""
"アイラ","","え……","","",""
"","","あ、動揺してる。アイラって、エルさんのノリをけっこう苦手にしてたりするんだよな……。","","",""
"アイラ","","……い、行く","","",""
"ツカサ","","よし、じゃあ決まりだ。最後は花火も打ち上がって、すごく盛り上がるんだって","","",""
"アイラ","","生で打ち上げ花火を見たこと、一度もない","","",""
"ツカサ","","そうなの？","","",""
"ツカサ","","音がすごくて、きっとびっくりするよ","","",""
"アイラ","","音……","","",""
"アイラ","","み、耳栓、用意した方がいい！？","","",""
"ツカサ","","いや、そこまでしなくても大丈夫だから……あはは","","",""
"","","エルさんの地元は、俺たちが暮らす寮から電車で１時間半くらいの場所にあった。サーファーたちからは聖地と呼ばれることもある、有名な海沿いの街だ。","","",""
"","","海岸近くの駐車場に到着して車を降りたときには、カーニバルは始まっていた。","","",""
"エル","","ああ～、時間があればアイラっちのために浴衣を用意したのに～！","","",""
"エル","","い、今から……今からでも買いに行きませんか！？　地元だから、そういう店がどこにあるかは知り尽くしてますんで！","","",""
"アイラ","","ひ、必要ないので……","","",""
"ツカサ","","エルさん、それはまずいですって。そろそろアンディとの待ち合わせ時間でしょ","","",""
"エル","","でも～……","","",""
"アンディ","","おーい！","","",""
"","","と、人ごみを縫うようにして、アンディが手を振りながら駆け寄って来た。","","",""
"アンディ","","悪いね。待たせちゃった？","","",""
"エル","","いえいえ、私たちもついさっき来たところです","","",""
"アンディ","","今夜は付き合ってくれてありがとう","","",""
"アンディ","","なんだかワクワクするなあ。こういうところ、なかなか来られないから。エルくんと友達になってよかった","","",""
"エル","","あはは……それはどうも","","",""
"","","花火まではまだ時間があった。","","",""
"","","アンディと合流した俺たちは、屋台がたくさん出ている会場を一通り歩いてみることにした。","","",""
"ツカサ","","じゃあ俺、撮影係をやりますよ。記念の写真を、たくさん撮りますね","","",""
"","","そうやってエルとアンディの写真を撮ることで、かつてエルとオリヴィアがこのカーニバルで過ごした頃の想い出がよみがえるかもしれない。","","",""
"","","そうなることを、俺は……望んでいる。","","",""
"","","メインストリートでは、山車が進んでいた。\nかなり大きくて、迫力がある。","","",""
"","","俺はひたすら、写真を――エルさんとアンディが楽しんでいる様子を――撮り続けた。","","",""
"","","屋台の食べ物や飲み物を買って、食べているところ。\n山車を見て驚いている様子など。","","",""
"","","アンディの様子は、今のところは“初体験”のカーニバルに心の底からを純粋に楽しんでいるように見えた。","","",""
"","","そうやって撮った写真の出来映えをチェックする。","","",""
"","","写真で見てみると、アンディとオリヴィアは雰囲気はまったく違うけど、やっぱり顔は同じだなって実感した。","","",""
"アンディ","","僕とエルくんばかりじゃないか","","",""
"","","アンディが、その写真を横からひょいとのぞき込んでくる。","","",""
"ツカサ","","アンディにも、後でデータで送るよ","","",""
"アンディ","","ああ、僕はいらないよ","","",""
"ツカサ","","え？　どうして――","","",""
"アンディ","","僕らギフティアは、忘れることはないからね。写真に残す必要なんてないのさ","","",""
"アンディ","","便利だろう？","","",""
"ツカサ","","うん……あはは","","",""
"","","かろうじて、笑顔で答えることができた。","","",""
"アンディ","","それより、アイラくんも撮ってあげるべきだよ","","",""
"ツカサ","","そうだね","","",""
"","","確かにアンディの指摘通り、撮るのに必死すぎて、アイラをあまり構ってあげられていないことに気付いた。","","",""
"アイラ","","…………","","",""
"","","あ、もしかして、ちょっと……怒ってるかも……。","","",""
"ツカサ","","アイラ、見る？　仲のいい姉妹みたいだよ","","",""
"","","なんとか機嫌を直してもらおうと、俺が撮ったエルさんとアンディの写真を見せてみたけど、アイラはそれをチラリと一瞥しただけで、なにも言ってくれなかった。","","",""
"ツカサ","","えっと、良かったら、アイラも撮ってあげようか？","","",""
"アイラ","","エラー。よく聞き取れませんでした。もう一度、言い直してください","","",""
"ツカサ","","え？　ええと、写真を","","",""
"アイラ","","エラー","","",""
"ツカサ","","き、機嫌悪い？","","",""
"","","まずいなあ。どうやって仲直りしよう……。","","",""
"","","と、近くの屋台でまたなにかを買ってきたエルさんとアンディが戻ってきた。","","",""
"アンディ","","２人とも、これ見てくれよ！","","",""
"","","手に持ったジュースを俺とアイラに見せびらかしてくる。","","",""
"ツカサ","","なに、それ？","","",""
"エル","","クラゲジュースです。一応、このカーニバルの名物ドリンクですね","","",""
"ツカサ","","味が想像できない……","","",""
"アンディ","","なあに、飲んでみれば分かるさ","","",""
"エル","","あ～、アンディはやめといた方が――","","",""
"","","エルさんの制止を無視して、アンディはジュースを飲み――。","","",""
"アンディ","","んん！　おいしい！　初めての味だけど悪くないよ！","","",""
"エル","","え、そう……ですか。悪くないですか……","","",""
"アンディ","","エルくんは苦手なのかい？","","",""
"エル","","ま、まあ……。私がっていうか、ええと……ははは","","",""
"","","エルさんのその態度で、ピンと来た。","","",""
"","","きっと、オリヴィアはクラゲジュースが苦手だったんだ。","","",""
"","","ＯＳを入れ替えてまったく別の人格になると、味覚の好みも変わるっていうことなのかな。","","",""
"","","と、アンディは離れた屋台の方を指差した。","","",""
"アンディ","","あっ、あれ！　なんだいあれ！","","",""
"","","目をキラキラさせて、あらゆるものに興味を示しているアンディの様子は、子供みたいで。とにかく“はじめて”が楽しくてしょうがないっていう様子だ。","","",""
"","","……思い出す気配すら、見せない。","","",""
"","","やっぱり、ターミナルサービスのみんなが言っていた通り、記憶が戻るなんていうことは、ないのかな……。","","",""
"","","エルさんがアンディを連れて、歩き出す。","","",""
"ツカサ","","ほら、アイラも行こう。はぐれないように気を付けて","","",""
"アイラ","","…………","","",""
"アイラ","","私は、子供じゃないので","","",""
"ツカサ","","あはは。ごめん","","",""
"","","でもこういうときって、カップルならはぐれないように手を繋ぐっていうのが、自然な流れ……だよね。","","",""
"","","こういうときは、ちょっとぐらい強引に繋いじゃっても……。","","",""
"","","なんて少しドキドキしていたら。","","",""
"アンディ","","ツカサくん！　アイラくん！　これ見てみなよ！　すごいよ！","","",""
"","","アンディが、遠くから呼びかけてきた。","","",""
"","","どうやら食べ物の次は、ゲーム系の屋台に目を付けたみたいだ。","","",""
"ツカサ","","本当に子供みたいだなあ","","",""
"","","振り回されるエルさんはどんな気持ちなんだろうと思いながら、アンディの元へと向かった。","","",""
"","","その後、金魚すくいやヨーヨー釣りなどを経て、アンディは今は射的を楽しんでいた。","","",""
"","","そんなアンディの様子を撮影していたら、エルさんに肩を叩かれた。","","",""
"エル","","写真、私にも見せてもらえます？","","",""
"","","ここまででかなりの枚数になっていた。\n端末に撮りためた写真をいくつか見せると、エルさんはくすぐったそうな、それでいて泣き出しそうな笑みを浮かべた。","","",""
"エル","","かなりあちこち回りましたね。アンディ、楽しそう……","","",""
"エル","","どうです？　記憶、戻ると思いますか？","","",""
"ツカサ","","…………","","",""
"","","俺は……答えられなかった。","","",""
"","","可能性はまだゼロだと決まったわけじゃない……。そう答えたってよかったのに、言葉にできなかった。","","",""
"","","今のところ、アンディにはそういう様子はまったく見られなかったから。","","",""
"エル","","そう。それが現実です","","",""
"","","それが、現実……。","","",""
"","","エルさんのその言葉は、俺の心に重く響いた。","","",""
"エル","","……私、きっと来年は、このカーニバルに来ることはないと思うんです","","",""
"","","エルさんは、遠い目をして夜空を見上げている。","","",""
"エル","","その代わりに、アンディと一緒にどこか別のところへ遊びに行きますよ","","",""
"エル","","アンディとは、オリヴィアの想い出を共有するんじゃなくて、これから新しく想い出を作っていきたいですし","","",""
"エル","","そうじゃなきゃ、オリヴィアにも、アンディにも失礼じゃないですか","","",""
"ツカサ","","エルさん……","","",""
"エル","","今日は付き合ってくれてどうもです。おかげで、私も吹っ切ることができたかも","","",""
"","","吹っ切る……。","","",""
"","","本当に、それでいいの？","","",""
"ツカサ","","吹っ切らなくちゃ……いけないんですか……","","",""
"","","叫び出しそうになった。\nここで俺が“吹っ切る”ことが、なにを意味するのか。\nイヤでも考えてしまうんだ。","","",""
"エル","","……ねえツカサっち","","",""
"エル","","想い出を作れるのは、今だけ、なんです","","",""
"エル","","今この瞬間しかないんですよ","","",""
"ツカサ","","……！","","",""
"ツカサ","","今、この瞬間……","","",""
"","","そのとき、夜空がパッと明るくなり、轟音が響き渡った。","","",""
"","","周囲の誰もがその音に驚き、空を見上げて歓声を上げる。","","",""
"ツカサ","","花火……","","",""
"アイラ","","生で打ち上げ花火を見たこと、一度もない","","",""
"ツカサ","","……！","","",""
"","","俺はふと我に返って、周囲を見回した。","","",""
"ツカサ","","あれ？　アイラは？","","",""
"","","アイラの姿が、どこにもなかった。","","",""
"エル","","もしかして、はぐれちゃったんじゃ？","","",""
"","","なんてことだ……。","","",""
"","","俺は、いったいなにやってるんだ……！","","",""
"ツカサ","","捜してきます！","","",""
"","","カーニバル会場は人でごった返している。","","",""
"","","誰もが夜空に咲く花火を見上げている。","","",""
"","","そんな中、俺はアイラの姿を捜し続けた。","","",""
"","","ごめん……。","","",""
"","","ごめん、俺、焦ってた。","","",""
"","","かすかな可能性にすがろうとして、“今”を全然見てなかった。","","",""
"","","せっかく、一緒に来たのに。","","",""
"","","せっかく、一緒に見ようって約束したのに。","","",""
"","","だから、早くアイラを見つけないと……！","","",""
"ツカサ","","今日の俺、おかしかったよね――","","",""
"","","言いかけたところで、また花火が上がった。","","",""
"アイラ","","っ！？","","",""
"","","アイラは、音にビックリして身を縮こまらせている。","","",""
"ツカサ","","音、すごいでしょ？","","",""
"アイラ","","うん……","","",""
"","","うなずくアイラの手を、俺は、少し強引に、握りしめた。","","",""
"","","指を絡めると、アイラも、それに応えてくれた。","","",""
"","","ドキドキして、アイラの顔を、まともに見られない。","","",""
"","","ふたりで肩を並べて、花火を見上げる。","","",""
"","","アイラはもう、花火が打ち上がっても怯えたりしなかった。","","",""
"ツカサ","","…………","","",""
"アイラ","","…………","","",""
"アイラ","","ねえ、ツカサ","","",""
"ツカサ","","ん？","","",""
"アイラ","","アンディの記憶、戻らなかったんでしょう？","","",""
"ツカサ","","え？　なんでそのこと……","","",""
"アイラ","","…………","","",""
"アイラ","","もしかして私は、ツカサを苦しめてる？　だったら、言ってほしい","","",""
"アイラ","","私は、ツカサを苦しめてまで、パートナーでいたいとは思わないので","","",""
"ツカサ","","……っ","","",""
"","","気が付いたときには、俺は、アイラのことを抱きしめていた。","","",""
"ツカサ","","ああ、苦しいよ。苦しくて苦しくて胸が張り裂けそうだ","","",""
"ツカサ","","それでも俺は、ずっとアイラのパートナーでいたいんだ！","","",""
"アイラ","","どうして、そこまで","","",""
"ツカサ","","どうしてって、そんなの――","","",""
"アイラ","","私に残された時間はね、あと……１０００時間ちょっとなので……","","",""
"ツカサ","","そんなの……！","","",""
"","","――君のことが好きだから。","","",""
"","","そう言おうとした。","","",""
"","","でも。","","",""
"ツカサ","","パートナーだからに、決まってるじゃないか","","",""
"","","言えなかった。","","",""
"","","ここで告白することは、俺だけのエゴなんじゃないか。","","",""
"","","今日、自分が望む答えを見つけるのに必死で、アイラのことをほったらかしにしちゃった俺なんかに、告白する権利はないんじゃないか。","","",""
"","","アイラを、苦しめちゃうことになるんじゃないか。","","",""
"","","そんな風に考えちゃって。","","",""
"","","とてもじゃないけど、勢いだけで気持ちを伝えるなんて、できなかったんだ。","","",""
"アイラ","","ありがとう……","","",""
"アイラ","","ツカサ、ありがとう……","","",""
"","","アイラの感謝の言葉が、逆に、心苦しかった。","","",""
"","","俺は、アイラから身を離し、しっかりとアイラの目を見つめた。","","",""
"ツカサ","","俺は、アイラが好きだから","","",""
"アイラ","","……！","","",""
"","","アイラは、びっくりしていた。","","",""
"","","しばらく言葉もなくアワアワしていたけど、徐々に顔が真っ赤になっていって。","","",""
"","","やがて、叫ぶようにして、こう言った。","","",""
"アイラ","","ム、ム、ム、ムリですぅ！","","",""
"ツカサ","","……！","","",""
"","","え？","","",""
"","","ムリ？","","",""
"","","本当に？","","",""
"","","終わった。","","",""
"","","俺の人生、終わった……。","","",""
