"ツカサ","","…………","","",""
"","","ベッドに入って、すでに２時間ほど。\nいつもならとっくに眠りについている時間なのに、今日は寝付けずにいた。","","",""
"","","いろいろ考えちゃって……っていう理由もあるけど。","","",""
"","","それ以上に、お腹がすいていたんだ。","","",""
"","","今日は、昼食を中途半端な時間に食べたこともあって、夕食はパン１個で済ませちゃったのがまずかった。","","",""
"","","かといって、この空腹を満たそうにも、部屋に食材を買い置きしているわけじゃない。","","",""
"","","すでに充電装置に座って休んでいるアイラにも迷惑だし。","","",""
"","","……しょうがない。外で買ってこよう。","","",""
"","","２４時間営業のファストフード店が、ちょっと歩いたところにあったはず。","","",""
"","","俺は着替えると、音を立てずに部屋を出た。","","",""
"","","エレベーターで１階に降り、玄関から出て行こうとしたら。","","",""
"ツカサ","","……？","","",""
"","","廊下もロビーも玄関もすでに消灯されているのに、食堂にだけ煌々と明かりが点いていた。いつもなら、夜の８時前には閉まっちゃうはずなのに。","","",""
"","","俺はそーっと、食堂の中をのぞき込んでみた。","","",""
"ツカサ","","失礼しまーす。誰かいます？","","",""
"エル","","――結論を言うと、生身の人間は必要ないということです！","","",""
"ツカサ","","！？","","",""
"エル","","おや？","","",""
"ミチル","","うん？","","",""
"","","広い食堂にいたのは、エルさんとミチルだった。\nふたり以外には誰の姿も見えない。","","",""
"ミチル","","なんだ、ツカサじゃない。どうかしたの？","","",""
"エル","","ども、ツカサっち。のぞきですか？","","",""
"ツカサ","","違いますよ。明かりが点いていたから、誰かいるのかと思ったんです","","",""
"ツカサ","","ふたりとも、こんな時間にここでなにを？","","",""
"エル","","見て分かりませんか？","","",""
"ツカサ","","見て……ですか？","","",""
"","","エルさんもミチルも、ラフな格好だ。テーブルには……お菓子が大量に広げられている。","","",""
"","","飲み物は、１階自販機コーナーに売っている缶コーヒーと缶紅茶。","","",""
"ツカサ","","仕事の話じゃ、なさそうですね……","","",""
"エル","","乙女トークです！　恋バナです！","","",""
"ミチル","","単なる雑談よ","","",""
"エル","","いやあ、話に夢中になりすぎて、時間を忘れてしまいました","","",""
"ツカサ","","なるほど……","","",""
"ミチル","","そういうツカサはなにしてるの？","","",""
"ツカサ","","ちょっと小腹がすいちゃって。外に買いに行こうと思ってたんだ","","",""
"","","と、タイミングよく俺のお腹がぐぅっと鳴った。","","",""
"エル","","よかったら、食べます？　まだたくさんありますし","","",""
"","","エルさんがテーブルの上のお菓子を指し示す。","","",""
"エル","","っていうか、せっかくだしツカサっちも参加していってくださいよ","","",""
"ミチル","","はあ！？　エル！　あんたなに言ってんのよ！？","","",""
"エル","","まあまあ、ミチルっち。ツカサっちには、いろいろ聞きたいこともあるじゃないですか","","",""
"ミチル","","わ、私は別に、聞きたいことなんて……","","",""
"エル","","というわけで、ほら、ツカサっち、座って座って","","",""
"","","確かに外まで買いに行くのも面倒だし、ここでお菓子にありつけるなら、ちょうどいいかもしれない。同僚――というか先輩――との交流を深めるのも大事だし。","","",""
"ツカサ","","ええと、いいのかな……","","",""
"","","ミチルの顔色をうかがってみると。","","",""
"ミチル","","勝手にすれば？","","",""
"ツカサ","","それじゃ、遠慮なく","","",""
"","","でも、腰を下ろすなり、エルさんがいきなり核心を突いてきた。\nまだ開けていなかった缶コーヒーをひとつ、俺の前に置きながら――","","",""
"エル","","いやあ、私、ツカサっちはてっきり、アイラっちが好きだと思っていたんですよ","","",""
"ツカサ","","えっ！？","","",""
"","","なかなかストレートに突っ込んでくるなあ……。","","",""
"エル","","カーニバルでも、途中まではあんまりムードよくなかったけど、花火が始まってから盛り返したでしょう？","","",""
"エル","","てっきりあそこで告白するのかと思って、アンディと一緒に見ながら、ドキドキしてたんですよ～","","",""
"ツカサ","","み、見てたんですか……","","",""
"エル","","ええ。ばっちりと","","",""
"","","あそこで告白してたら、あっという間に職場に広められていたに違いない。油断も隙もないなあ。","","",""
"エル","","で、今後、告白する予定はないんですか？","","",""
"ツカサ","","な、ないです……","","",""
"","","顔に動揺が出そうになったのを、缶コーヒーを飲んでごまかそうとしたら。","","",""
"エル","","だって、好きなんですよね？","","",""
"ツカサ","","げほげほっ","","",""
"","","またもストレートに突っ込まれて、たまらずむせてしまった。","","",""
"ツカサ","","……なんでそう思うんですか？","","",""
"エル","","バレバレですよ～。“好き好きオーラ”が出まくりだったじゃないですか","","",""
"","","で、出まくりだった……のか……。","","",""
"エル","","アイラっちのこと、何度もデートに誘ったりしてたし","","",""
"エル","","いつも必死になってアイラっちのこと考えてたし","","",""
"エル","","でも、そんなツカサっちがいたからこそ、アイラっちも一時期に比べてすごく明るくなったわけで","","",""
"エル","","私はお似合いだと思うんですよね","","",""
"エル","","ちなみに、アイラっちのどのへんを好きになったんです？　見た目？　性格？","","",""
"ツカサ","","ええと……","","",""
"","","真面目に答えるのは、かなり恥ずかしいんだけど……。","","",""
"","","この状況だと、もうごまかすのは無理みたいだ。","","",""
"ツカサ","","雰囲気、ですかね。一目惚れだったんで……","","",""
"エル","エル・ミチル","きゃー！","","",""
"","","いきなり女子ふたりのテンションがあがった。\nさすが、この時間まで恋バナをしていただけある……。","","",""
"エル","","一目惚れ！　素敵じゃないですか！","","",""
"ミチル","","いいわよね～！　私も一目惚れ、してみたい！","","",""
"エル","","ミチルっちはないんですか？","","",""
"ミチル","","そうなのよ……。だから、どういう感覚なのか想像つかなくて……","","",""
"エル","","すとんと、心に落っこちてくる感じ、ですかね","","",""
"エル","","なんの違和感もなく、あ、私、好きだ――って思っちゃうというか","","",""
"ツカサ","","分かります！","","",""
"","","って、つい、俺まで力強くうなずいてしまった……。","","",""
"ミチル","","なによ、エルも一目惚れの経験あるの？","","",""
"エル","","そりゃもう。毎日一目惚れしまくりです","","",""
"","","か、軽いなあ……。\nどうせ、相手はギフティアに限定されてるんだろうなあ。","","",""
"エル","","ねえツカサっち。その気持ち、アイラっちに伝えなくてもいいんですか？","","",""
"エル","","もう、時間は残されてないんですよ？","","",""
"ツカサ","","…………","","",""
"ツカサ","","アイラは、俺にとって……大切な、パートナーです","","",""
"ツカサ","","俺が言えるのは、それだけです","","",""
"エル","","でも……","","",""
"ミチル","","エル、ストップ","","",""
"","","ミチルが止めてくれた。","","",""
"ミチル","","ツカサはうちに入ってまだ３ヶ月経ってないのよ？","","",""
"ミチル","","受け止めるだけで、精一杯よ","","",""
"","","ミチルは、俺が感じている苦しみを分かってくれているんだろう。\nかつて、育ての親だったギフティアとの別れを経験しているから。","","",""
"ミチル","","もし辛くなったら、話し相手にぐらいはなるから。あんまり抱え込まないこと。それと、できるだけ誰かを頼ること","","",""
"ミチル","","くれぐれも、ひとりでなんとかしようなんて考えないこと。いいわね","","",""
"ツカサ","","うん……。ありがとう","","",""
"","","そうやって気遣ってもらえるのは、ありがたかった。","","",""
"エル","","むむ……","","",""
"エル","","これは、恋が生まれるきっかけですかねぇ","","",""
"ミチル","","はあ！？","","",""
"エル","","そういう可能性も、なきにしもあらずじゃないですか？","","",""
"ツカサ","","いやいやいや","","",""
"","","アイラのこともまだ整理できてないのに、他の人と恋に落ちるなんて、まったくそんな余裕は俺にはないよ……。","","",""
"ミチル","","変なこと言わないで。ツカサみたいなヘタレでヘラヘラしてるやつなんて、絶対好きにならないし！","","",""
"","","そ、そこまで全力で否定されると、俺も悲しいけど……。","","",""
"ミチル","","私の理想の彼は、ツカサとは似ても似つかない、素敵な人なんだから","","",""
"エル","","ほほぅ","","",""
"ツカサ","","へえ。ミチルって好きな人いたんだ","","",""
"ミチル","","実在はしないわよっ","","",""
"ツカサ","","え？　ど、どういうこと？","","",""
"エル","","理想のタイプ、ってことですね。言ってみれば白馬の王子様","","",""
"ミチル","","そう。運命の人。その人は遠い異国の地から、私を迎えに来てくれるの","","",""
"ミチル","","本当は身分の高い人で、私なんかじゃとても釣り合いは取れないのに、私は、一目でその人と恋に落ちる……","","",""
"ミチル","","『君のためなら、僕はこの地位すらも捨てよう』","","",""
"ミチル","","『あなたとなら、世界の果てにだってついていくわ』","","",""
"エル","","乙女っすね～","","",""
"エル","","しかも、ちゃんと一目惚れ要素も入れてきましたか","","",""
"ミチル","","ハッ！？","","",""
"","","あ、我に返った。","","",""
"ミチル","","い、今のは違うから！","","",""
"ミチル","","なんか、そういう、小説とか映画とかを、見たことがあったような、ないようなっていう話だからっ","","",""
"ツカサ","","確かに、少女マンガみたいだった","","",""
"ツカサ","","そういう人が、いつかミチルの前に現れるといいね","","",""
"","","本気でそう言ったんだけど、ミチルには冷たい目でにらまれた。","","",""
"ミチル","","あんた、バカにしてるでしょ？","","",""
"ツカサ","","ええっ？　俺は本気で……","","",""
"ミチル","","はあ、もういいわよ","","",""
"ミチル","","そもそも私、人間の男性にはちょっと抵抗あるのよね。だから、実際にそんな人が現れたって、積極的になれない気がする","","",""
"ツカサ","","抵抗あるの？","","",""
"ミチル","","アンドロイド・チルドレンって、そういう人が多いんだって","","",""
"ミチル","","私も、小さい頃からギフティアの父さんに育てられたし、やっぱりそれが原因でイジメにあったりもしたから","","",""
"ミチル","","特に小さい頃は、男子がよってたかってひとりの女子を泣かせる、なんてよくあったでしょ","","",""
"ミチル","","そういうことが重なって、今でもあんまり信用できないの。ついついこっちも強く出ちゃうのよね","","",""
"","","ミチルのことだから、よってたかっていじめてきた男子を返り討ちにしてそうだけど……。","","",""
"ツカサ","","もしかして、俺に厳しいのもそれが理由？","","",""
"ミチル","","ツカサは、単に仕事ができないからよっ","","",""
"ツカサ","","す、すみません……","","",""
"ミチル","","だから私、ギフティアの方が好きになりやすいかもしれないわ","","",""
"ツカサ","","ミチルは、ギフティアとの恋愛には肯定的なんだね","","",""
"エル","","私もですよ！　私も！","","",""
"ツカサ","","あ、はは、それは知ってます","","",""
"ミチル","","世間的にも、アンドロイドと恋愛することに、そこまで変な目で見られなくなったしね","","",""
"ミチル","","私も、仕事を通して、素敵だなって思う回収対象には、たくさん会ったわ","","",""
"エル","","身近なギフティアだと、どうです？","","",""
"ミチル","","コンスタンスは紳士よね。ああいう大人のギフティアも悪くないわ","","",""
"エル","","ということは、ザックっちは私がいただいてもいいんですね？","","",""
"ミチル","","あげないわよ！　ザックは私の弟みたいなものなんだから！","","",""
"エル","","えー、ずるーい","","",""
"ミチル","","っていうか、そういうエルはどうなの！？　どんな男性がタイプなのよ！","","",""
"エル","","ん～、そうですねえ。じゃあ、私の師匠がめちゃくちゃ素敵なんですよ～っていう話、します？","","",""
"ツカサ","","それ、この前聞きましたよ……","","",""
"ミチル","","師匠って、オヤジさんのこと？","","",""
"ミチル","","あんた、年上好きなの？","","",""
"エル","","ではお話しましょう。ツカサっちは、黙っててくださいね～？","","",""
"ミチル","","必要ないわよ。どうせエルのことだから、オヤジさんがギフティアなら最高だった、とかそういうオチでしょ","","",""
"ツカサ","","よ、読まれてる……","","",""
"エル","","さすがです、ミチルっち……","","",""
"ミチル","","エルが分かりやすすぎるのよ","","",""
"ミチル","","ギフティアマニアっていつも公言してるじゃない","","",""
"エル","","その通りです！","","",""
"ツカサ","","じゃあ、自分好みのギフティアをオーダーメイドで注文すればいいんじゃないですか？","","",""
"","","そうすれば、アイラやザックが今後、セクハラの被害に遭うことはなくなるわけで。","","",""
"エル","","実は一度、試してみたんですよ","","",""
"ツカサ","","え？　本当に？","","",""
"エル","","ええ。近くのショールームへ行って、お試しでオーダーしてみたんです","","",""
"ミチル","","理想の人は、見つかったの？","","",""
"エル","","いいえ……","","",""
"エル","","私の理想があまりに高すぎて、いつまでたっても納得できず……","","",""
"エル","","ショールームのスタッフに、もう付き合いきれないって、匙を投げられました","","",""
"ツカサ","","さすが、筋金入りですね……","","",""
"ミチル","","その情熱には、ある意味尊敬するわ……","","",""
"エル","","でもいいんです。私は、今の職場にアイラっちとザックっちがいるだけで、幸せなんですよ","","",""
"ツカサ","","…………","","",""
"ミチル","","…………","","",""
"","","ふと、沈黙が３人の間に舞い降りた。","","",""
"","","そこにいるのが当たり前だったのに。\nあと少ししたら、大切な存在がいなくなってしまう。","","",""
"","","できるだけ気にしないフリをしようって思っていても、やっぱり、アイラのことを考えちゃうんだ。","","",""
"エル","","あと、１週間くらいですか……","","",""
"ツカサ","","……そう、ですね","","",""
"ミチル","","…………","","",""
"エル","","そ、それまでに、なんとかしてアイラっちと一夜をともに……！","","",""
"ツカサ","","エルさん……","","",""
"ミチル","","この先、エルをアイラに近づけさせない方がいいかもしれないわ","","",""
"エル","","ええっ、そんな！　ミチルっち、ひどいです！　なんの権限があってそんなことを！","","",""
"ミチル","","回収対象のストレスをできるだけ軽減してあげるのが、第１ターミナルサービスのやり方なの","","",""
"エル","","私から人生の喜びを奪わないで～","","",""
"ツカサ","","あはは……","","",""
"","","ふたりとも、だんだん深夜のおかしなテンションになってきたような気がする。","","",""
"","","とりあえず、お菓子もいただいて空腹はおさまったし、俺は寝るためにその時点で離脱したんだけど……。","","",""
"","","ふたりはまだ喋り足りないみたいで、食堂に残った。","","",""
"","","次の日の朝、会社で会ったエルさんやミチルは目を充血させていて、すごく眠そうだった。","","",""
